pathway	pval	padj	ES	NES	nMoreExtreme	size	leadingEdge
"Regulation of PTEN stability and activity"	0.0222977702229777	0.201428737723243	0.570381622043002	1.28269763826096	222	67	AKT2 PSMD9 PSMD6 PSMD2 PSMC1 PSMB9 CSNK2A1 PSMB8 UBC PSMB4 AKT3 CSNK2B FRK PSMD4 PSMD11 PSMC4 NEDD4 PSMB10 RNF146 OTUD3 UBA52 PSMB7 PSME3 AKT1 PSMA7 PSMC2 PSMD7 UBB PSMD12 PSMD13 PSMC3 PSMC6 PSMA5 PSMF1 WWP2 PSMD1 CSNK2A2 TRIM27 PSMA6 PREX2 PSMA3
"Regulation of RAS by GAPs"	0.0093990600939906	0.132167817700989	0.592409662403209	1.33045570413199	93	65	RASAL1 PSMD9 PSMD6 PSMD2 PSMC1 PSMB9 PSMB8 UBC PSMB4 PSMD4 SYNGAP1 PSMD11 PSMC4 PSMB10 RBX1 RASAL2 CUL3 NF1 UBA52 PSMB7 PSME3 RASA2 KRAS PSMA7 PSMC2 PSMD7 UBB PSMD12 PSMD13 NRAS PSMC3 PSMC6 PSMA5 PSMF1
"Regulation of RUNX1 Expression and Activity"	0.149085091490851	0.450043649001683	0.602273125121513	1.25747142969992	1490	17	H19 CCND1 TNRC6A CCND3 AGO1 TNRC6B AGO3 CBFB CDK6 TNRC6C SRC PTPN11
"Regulation of RUNX2 expression and activity"	0.0514948505149485	0.30186206560942	0.546707679658396	1.23090205980599	514	69	GSK3B PSMD9 PSMD6 PSMD2 PSMC1 PSMB9 PSMB8 NR3C1 UBC PPARGC1B PSMB4 PSMD4 PSMD11 PSMC4 PSMB10 RBX1 UBA52 PSMB7 PSME3 FBXW7 PSMA7 PSMC2 PSMD7 UBB PSMD12 PSMD13 CBFB WWP1 PSMC3 PSMC6 PSMA5 PSMF1 PPARGC1A PSMD1
"Regulation of RUNX3 expression and activity"	0.0201979802019798	0.193849755649435	0.591769296937123	1.32053385642466	201	55	CDKN2A PSMD9 PSMD6 PSMD2 PSMC1 PSMB9 PSMB8 UBC PSMB4 PSMD4 PSMD11 PSMC4 PSMB10 UBA52 PSMB7 EP300 PSME3 PSMA7 SMURF2 PSMC2 PSMD7 UBB PSMD12 PSMD13 CBFB PSMC3 PSMC6 PSMA5 PSMF1
"Regulation of TLR by endogenous ligand"	0.602639736026397	0.771496701359975	0.461803847327205	0.929146433503254	6026	10	HMGB1 GSDMD
"Regulation of TNFR1 signaling"	0.0596940305969403	0.314172278424332	0.589572421625366	1.2872889740337	596	35	USP4 RNF31 UBC IKBKG CYLD RACK1 TAX1BP1 CFLAR USP2 CASP8 RBCK1 CLIP3 UBA52 UBB SPPL2B CHUK TNFRSF1A USP21 MADD
"Regulation of TP53 Activity"	0.0231976802319768	0.20723831675873	0.517592401047474	1.19737298963403	231	153	PIP4K2A AKT2 TP53 CDKN2A WRN TOPBP1 RBBP4 TAF4B HDAC2 PPP2R5C CSNK2A1 UBC TAF15 EHMT1 ATM ATR MEAF6 L3MBTL1 KAT6A AKT3 CSNK2B PRKAG2 ING5 RFFL TAF12 GATAD2B MAPKAPK5 USP2 EHMT2 BARD1 PDPK1 CHD4 CHEK1 RAD9A UBA52 RNF34 RMI2 HUS1 EP300 RPA1 AKT1 STK11 PPP1R13L RBBP7 PRMT5 MAPKAP1 PPP2R1A UBB TAF1 BANP USP7 RAD50 KMT5A MBD3 CCNG1 CHEK2 TAF13 NOC2L HDAC1 AURKB ATRIP TOP3A PPP2CA PRKAA2 CSNK2A2 HIPK1 BRPF3 MTOR BRCA1 PRKAB1 PIN1 RBBP8 TP53RK CDK5R1 ZNF385A TTC5
"Regulation of TP53 Activity through Acetylation"	0.0201979802019798	0.193849755649435	0.651387316469566	1.40669648682153	201	29	PIP4K2A AKT2 TP53 RBBP4 HDAC2 MEAF6 KAT6A AKT3 ING5 GATAD2B CHD4 EP300 AKT1 RBBP7
"Regulation of TP53 Activity through Association with Co-factors"	0.0981901809819018	0.385832775945706	0.675280388382793	1.36987246587383	981	11	AKT2 TP53 AKT3 AKT1 PPP1R13L BANP
"Regulation of TP53 Activity through Methylation"	0.0715928407159284	0.342542030381942	0.635073245253805	1.3381206064256	715	19	TP53 UBC EHMT1 ATM L3MBTL1 EHMT2 UBA52 EP300 PRMT5 UBB KMT5A CHEK2
"Regulation of TP53 Activity through Phosphorylation"	0.306869313068693	0.584589305775305	0.467591970137759	1.06332321832692	3068	90	TP53 WRN TOPBP1 TAF4B CSNK2A1 UBC TAF15 ATM ATR CSNK2B PRKAG2 TAF12 MAPKAPK5 BARD1 CHEK1 RAD9A UBA52 RMI2 HUS1 RPA1 STK11 UBB TAF1 RAD50 CHEK2 TAF13 NOC2L AURKB ATRIP TOP3A PRKAA2 CSNK2A2 HIPK1 BRCA1 PRKAB1 PIN1 RBBP8 TP53RK CDK5R1 MRE11 TAF6 RFC5
"Regulation of TP53 Degradation"	0.0362963703629637	0.248933463594151	0.606120197861991	1.32485636970509	362	36	AKT2 TP53 CDKN2A PPP2R5C UBC ATM AKT3 RFFL USP2 PDPK1 UBA52 RNF34 AKT1 MAPKAP1 PPP2R1A UBB USP7 CCNG1 CHEK2
"Regulation of TP53 Expression"	0.006999300069993	0.128373526283735	0.992630803242447	2.0011104688108	69	1	TP53
"Regulation of TP53 Expression and Degradation"	0.0362963703629637	0.248933463594151	0.606120197861991	1.32485636970509	362	36	AKT2 TP53 CDKN2A PPP2R5C UBC ATM AKT3 RFFL USP2 PDPK1 UBA52 RNF34 AKT1 MAPKAP1 PPP2R1A UBB USP7 CCNG1 CHEK2
"Regulation of actin dynamics for phagocytic cup formation"	0.128787121287871	0.431249821075984	0.527043105262934	1.17708793701235	1287	56	VAV3 ACTR3 BAIAP2 PTK2 NCKAP1 CDC42 NCK1 ABI2 NCKAP1L LIMK1 GRB2 CFL1 NF2 SYK ARPC2 ELMO1 ARPC5 ABL1 CYFIP2 RAC1 WASF1 ACTB VAV2 ARPC4 MYO10 NCKIPSD ARPC1B
"Regulation of activated PAK-2p34 by proteasome mediated degradation"	0.0496950304969503	0.295606065929034	0.574584755258268	1.27416453874121	496	48	PSMD9 PSMD6 PSMD2 PSMC1 PSMB9 PSMB8 UBC PSMB4 PSMD4 PSMD11 PSMC4 PSMB10 UBA52 PSMB7 PSME3 PSMA7 PSMC2 PSMD7 UBB PSMD12 PSMD13 PSMC3 PSMC6 PSMA5 PSMF1
"Regulation of beta-cell development"	0.142185781421858	0.447635600549178	0.564462590267235	1.21658015561243	1421	28	AKT2 AKT3 MAML3 MAMLD1 CREBBP EP300 AKT1
"Regulation of cholesterol biosynthesis by SREBP (SREBF)"	0.102289771022898	0.393084977216564	0.538650000802602	1.20199808693114	1022	55	SQLE KPNB1 TM7SF2 ACACB SEC24B FDFT1 LSS TBL1XR1 SEC24C SCAP SC5D SMARCD3 GGPS1 FDPS TBL1X CREBBP SAR1B IDI1 NFYC ACACA NFYB CHD9 GPAM RAN CARM1 ELOVL6 MVD MBTPS1 NCOA1 SP1 MVK
"Regulation of commissural axon pathfinding by SLIT and ROBO"	0.798020197980202	0.881981569284932	0.373028084771966	0.744611586939306	7980	9	SLIT3 NTN1 SRC NELL2 SLIT1 SLIT2
"Regulation of cortical dendrite branching"	0.950604939506049	0.980995122994095	0.177469909665744	0.336595792370837	9506	4	ROBO1 ROBO2 NCK2 SLIT1
"Regulation of cytoskeletal remodeling and cell spreading by IPP complex components"	0.191780821917808	0.496035775291201	0.649324040289366	1.28570480600732	1917	8	ACTN1 PXN PARVB TESK1 ARHGEF6
"Regulation of expression of SLITs and ROBOs"	0.0011998800119988	0.0528165365281654	0.560889414200864	1.29958979016283	11	163	EIF4G1 ZSWIM8 RPS24 USP33 RPL18A RPL35 RPL22L1 PSMD9 PSMD6 PSMD2 RPS21 RPS9 RPS6 PSMC1 RPL24 RPL22 RPL7A RPL15 UPF3A PSMB9 PSMB8 UBC RPL6 PSMB4 RPL3 RPLP0 RPL27A PSMD4 RPS3 RPS14 PSMD11 RPL26 RPL17 PSMC4 RPL29 PSMB10 NCBP2 RPS26 RBX1 RPSA RPS8 GSPT2 RPL35A RPL8 RPL10A RPL10 UBA52 RPS29 PSMB7 PSME3 RPL32 RPL31 RPL9 RPS3A PSMA7 PSMC2 PSMD7 UBB PSMD12 PSMD13 RPL13A RNPS1 RPS20 PSMC3 RPL10L PSMC6 PSMA5 RPS13 RPL28 RPL5 RPL21 RPS2 RPL12 PSMF1 RPLP2 MAGOHB RPS15A RPL4 RPS18 RPS17 RPL38 PSMD1 RPL30 GSPT1
"Regulation of gap junction activity"	0.171082891710829	0.47390352497931	0.759777200017483	1.43003726270514	1710	3	TJP1 SRC
"Regulation of gene expression by Hypoxia-inducible Factor"	0.0203979602039796	0.193849755649435	0.771043596029483	1.55133486105133	203	10	EPAS1 VEGFA ARNT HIF3A CREBBP EP300
"Regulation of gene expression in beta cells"	0.0854914508549145	0.368264237406047	0.666303733984214	1.36845130290983	854	13	AKT2 AKT3 AKT1
"Regulation of gene expression in early pancreatic precursor cells"	0.869313068693131	0.926323476807249	0.282693171751224	0.536166003141856	8693	4	NKX6-1 NR5A2 ONECUT3 HNF1B
"Regulation of gene expression in endocrine-committed (NEUROG3+) progenitor cells"	0.765423457654235	0.859902640826405	0.231708600905359	0.467116782463948	7654	1	NEUROD1
"Regulation of gene expression in late stage (branching morphogenesis) pancreatic bud precursor cells"	0.351864813518648	0.612852311891113	0.538079610324087	1.10972612128693	3518	14	MAML3 MAMLD1 CREBBP EP300 SNW1 RBPJ HNF1B KAT2B
"Regulation of glycolysis by fructose 2,6-bisphosphate metabolism"	0.540645935406459	0.739486186897968	0.486496504386947	0.978827904053071	5406	10	PFKFB3 PPP2R1A PPP2CA
"Regulation of innate immune responses to cytosolic DNA"	0.234076592340766	0.526183314816151	0.580893753782413	1.19802527339123	2340	14	UBC STING1 TRIM32 UBA52 UBB TBK1 IRF3 TRIM56 TRIM21
"Regulation of insulin secretion"	0.0080991900809919	0.130720927907209	0.602931698471329	1.35123724502401	80	62	RAPGEF3 ADRA2C PRKAR1A IQGAP1 GNAI2 CHRM3 GNB1 SLC2A1 CACNA1D PLCB1 PRKAR2B AHCYL1 GNB2 GNB4 STX1A GNAS CACNB2 GNG5 ACSL3 ADRA2A VAMP2 CACNA2D2 PRKAR1B GNAI1 CACNA1A GLP1R
"Regulation of lipid metabolism by PPARalpha"	0.148285171482852	0.44874800019998	0.490075836652572	1.12190070981594	1482	108	FHL2 NCOR2 SIN3B CCNC MED14 MED9 FDFT1 ARNT PPARGC1B TBL1XR1 MED13L NCOR1 ANGPTL4 SMARCD3 MED22 MED17 ACADM TXNRD1 MED15 GPS2 MED26 TBL1X CREBBP ALAS1 MED25 CLOCK HDAC3 NFYC RXRB EP300 THRAP3 MED27 NCOA3 NFYB CDK19 MED6 CHD9 SLC27A1 PPARGC1A CDK8 MED12 CARM1 CPT1A ESRRA PLIN2 NCOA1 SIN3A SP1 CPT2 MED7 NPAS2 APOA1 MED18 NCOA6 MED30 MED23 AHRR MED13 MED21 NFYA MED31
"Regulation of localization of FOXO transcription factors"	0.103389661033897	0.393847449110888	0.660948708690325	1.35040250674176	1033	12	AKT2 AKT3 FOXO4 AKT1
"Regulation of mRNA stability by proteins that bind AU-rich elements"	0.013998600139986	0.15836734083601	0.563693017567816	1.28042800950116	139	87	EIF4G1 PSMD9 PSMD6 PSMD2 XPO1 XRN1 HSPA8 PSMC1 PSMB9 PSMB8 UBC NUP214 PSMB4 EXOSC3 PSMD4 PSMD11 HNRNPD PSMC4 PSMB10 PRKCD EXOSC2 UBA52 PSMB7 PSME3 AKT1 EXOSC7 TNPO1 PSMA7 PSMC2 PSMD7 UBB PSMD12 PSMD13 DCP1A PSMC3 DIS3 PSMC6 PSMA5
"Regulation of mitotic cell cycle"	0.135586441355864	0.436509008673601	0.502997011372842	1.14189681088777	1355	86	CDC27 PSMD9 PSMD6 PSMD2 PSMC1 CDC16 ANAPC2 PSMB9 PSMB8 UBC ANAPC5 PSMB4 PSMD4 PSMD11 PSMC4 ANAPC1 PSMB10 UBA52 PSMB7 PSME3 ANAPC7 PSMA7 PSMC2 PSMD7 UBB PSMD12 PSMD13 UBE2E1 PSMC3 PSMC6 PSMA5 PSMF1 AURKB PSMD1 ANAPC15 ANAPC11 CCNB1 CDC23 ANAPC16 PSMA6 PSMA3
"Regulation of necroptotic cell death"	0.711228877112289	0.831523350555118	0.411514231688826	0.886932201809342	7112	28	UBC PDCD6IP CFLAR CASP8 SDCBP UBA52 UBB OGT FAS FLOT2 CDC37
"Regulation of ornithine decarboxylase (ODC)"	0.0563943605639436	0.304756131529704	0.568242416938009	1.26093693508272	563	49	PSMD9 PSMD6 PSMD2 PSMC1 NQO1 PSMB9 PSMB8 PSMB4 PSMD4 PSMD11 PSMC4 PSMB10 OAZ1 PSMB7 PSME3 PSMA7 PSMC2 PSMD7 PSMD12 PSMD13 PSMC3 PSMC6 PSMA5 PSMF1
"Regulation of pyruvate dehydrogenase (PDH) complex"	0.0527947205279472	0.302871082754738	0.678947843343453	1.40686538136859	527	15	GSTZ1 PDP1 PDPR PDK1 PDHB PDHA1
"Regulation of signaling by CBL"	0.648735126487351	0.796689600816795	0.433618551483625	0.909171389253462	6487	18	PIK3CB FYN GRB2 YES1 SYK BLNK CRK PIK3R3 PIK3R1 CBL HCK PIK3CA LYN
"Regulation of signaling by NODAL"	0.397160283971603	0.647491614474916	0.561340218976453	1.10027591135111	3971	7	LEFTY2 ACVR2B ACVR1C
"Regulation of the apoptosome activity"	0.276972302769723	0.56180236247732	0.57955221723482	1.17567848642462	2769	11	UACA DIABLO CASP9 CARD8 APIP AVEN
"Release of Hh-Np from the secreting cell"	0.663233676632337	0.806312601822525	0.443231231215791	0.868771968191518	6632	7	ADAM17 GPC5 DISP2 SCUBE2 SHH DHH
"Release of apoptotic factors from the mitochondria"	0.646335366463354	0.795110732829156	0.451244607377585	0.884478886137811	6463	7	DIABLO BAK1 GSDMD BAX
"Removal of aminoterminal propeptides from gamma-carboxylated proteins"	0.0160983901609839	0.174772208877767	0.890773754664279	1.68947343433647	160	4	GAS6 BGLAP
"Removal of the Flap Intermediate"	0.751624837516248	0.852066123299009	0.397959121411809	0.820744038171392	7516	14	RPA1 POLD1 POLD2 POLD3 FEN1 POLA2 POLA1 PRIM2 PRIM1 DNA2 RPA2
"Removal of the Flap Intermediate from the C-strand"	0.504149585041496	0.721789559660237	0.48039363744264	1.00300220763107	5041	17	WRN ACD RPA1 POLD1 POLD2 POLD3 TINF2 TERF2IP FEN1 TERF1 TERF2
"Replication of the SARS-CoV-1 genome"	0.0267973202679732	0.220667729145453	0.870780699868193	1.65155388992651	267	4	DDX5 ZCRB1
"Replication of the SARS-CoV-2 genome"	0.0267973202679732	0.220667729145453	0.870780699868193	1.65155388992651	267	4	DDX5 ZCRB1
"Repression of WNT target genes"	0.144985501449855	0.44874800019998	0.620769903152705	1.28026515708781	1449	14	TLE2 TLE1 CTBP2 TCF7L1 CTBP1 TLE5 HDAC1 AXIN2 MYC TLE3
Reproduction	0.55974402559744	0.750354532653047	0.431626405448224	0.981172555311132	5597	89	REC8 SUN1 SYNE2 LMNB1 H2BC11 SUN2 SYNE1 ATM ATR CATSPERG ACD SMC1A RAD51C RPA1 MLH3 DIDO1 STAG1 SYCP2 RAD50 UBE2I TINF2 H2BC15 TOP3A H2BC4 H3-3A H2BC12 BRCA1 RBBP8 CDK4 STAG2 MRE11 H3C15 MLH1 TERF2IP
"Resistance of ERBB2 KD mutants to AEE788"	0.0546945305469453	0.302871082754738	0.834157868762712	1.58209371564666	546	4	ERBB2 ERBIN CDC37
"Resistance of ERBB2 KD mutants to afatinib"	0.0546945305469453	0.302871082754738	0.834157868762712	1.58209371564666	546	4	ERBB2 ERBIN CDC37
"Resistance of ERBB2 KD mutants to lapatinib"	0.0546945305469453	0.302871082754738	0.834157868762712	1.58209371564666	546	4	ERBB2 ERBIN CDC37
"Resistance of ERBB2 KD mutants to neratinib"	0.0546945305469453	0.302871082754738	0.834157868762712	1.58209371564666	546	4	ERBB2 ERBIN CDC37
"Resistance of ERBB2 KD mutants to osimertinib"	0.0546945305469453	0.302871082754738	0.834157868762712	1.58209371564666	546	4	ERBB2 ERBIN CDC37
"Resistance of ERBB2 KD mutants to sapitinib"	0.0546945305469453	0.302871082754738	0.834157868762712	1.58209371564666	546	4	ERBB2 ERBIN CDC37
"Resistance of ERBB2 KD mutants to tesevatinib"	0.0546945305469453	0.302871082754738	0.834157868762712	1.58209371564666	546	4	ERBB2 ERBIN CDC37
"Resistance of ERBB2 KD mutants to trastuzumab"	0.0546945305469453	0.302871082754738	0.834157868762712	1.58209371564666	546	4	ERBB2 ERBIN CDC37
"Resolution of AP sites via the multiple-nucleotide patch replacement pathway"	0.731026897310269	0.842313199698108	0.404997318138146	0.867099213366219	7310	25	RPA1 POLD1 POLD2 POLD3 RFC1 PARP2 RFC5 FEN1 POLE3 RFC2 APEX1 POLB PARG PARP1 POLE RFC4
"Resolution of AP sites via the single-nucleotide replacement pathway"	0.705729427057294	0.831523350555118	0.41344242702115	0.784149727607415	7057	4	APEX1 POLB LIG3
"Resolution of Abasic Sites (AP sites)"	0.851814818518148	0.917475868071556	0.368788860287232	0.808811468555164	8518	38	RPA1 POLD1 MBD4 POLD2 POLD3 RFC1 PARP2 UNG OGG1 RFC5 FEN1 POLE3 RFC2 SMUG1 MUTYH APEX1 NEIL1 POLB PARG PARP1 PNKP POLE RFC4 TDG LIG3 NTHL1 RPA2
"Resolution of D-Loop Structures"	0.666733326667333	0.808293131628249	0.422490705807994	0.919129227534627	6667	33	WRN ATM RAD51C XRCC3 BARD1 RTEL1 RMI2 RAD50 SPIDR TOP3A BRCA1 RBBP8 MRE11 EME1
"Resolution of D-loop Structures through Holliday Junction Intermediates"	0.721827817218278	0.83684095705262	0.407562088160848	0.885656489738674	7218	32	WRN ATM RAD51C XRCC3 BARD1 RMI2 RAD50 SPIDR TOP3A BRCA1 RBBP8 MRE11 EME1
"Resolution of D-loop Structures through Synthesis-Dependent Strand Annealing (SDSA)"	0.566843315668433	0.755888312267674	0.451132669384503	0.968225031947702	5668	26	WRN ATM RAD51C XRCC3 BARD1 RTEL1 RMI2 RAD50 TOP3A BRCA1 RBBP8 MRE11
"Resolution of Sister Chromatid Cohesion"	0.289371062893711	0.570959529963874	0.466332206551555	1.06648405385109	2893	105	DYNC1H1 RANGAP1 XPO1 DYNC1I2 NUP85 PPP2R5C CENPT ITGB3BP SMC1A MAD1L1 CLIP1 SKA2 SPDL1 AHCTF1 CENPC BUB1 CLASP2 CENPP HDAC8 PDS5B KNTC1 SPC24 STAG1 SEC13 PPP2R1A DYNLL1 TAOK1 PPP1CC CENPN RANBP2 SGO2 NUP37 AURKB PPP2R5E KIF2A PPP2CA NDC80 CENPK CCNB1 NUP160 CLASP1 PDS5A DYNC1LI2 NUP98 PAFAH1B1 SEH1L STAG2 PPP2R5B BUB3
"Respiratory electron transport"	0.530646935306469	0.73355044632523	0.433560261983332	0.991143155256096	5306	103	ACAD9 LRPPRC SDHA TIMMDC1 NDUFV1 NDUFB6 NDUFA10 COX4I1 NDUFB11 ETFA SURF1 COA1 NDUFA11 SCO1 NDUFB1 UQCRC1 ETFDH COX6A1 NDUFA2 UQCR11 COX6C NDUFS8 NDUFAF7 NDUFA13 NDUFC1 MT-ND1 TRAP1 COX5B UQCRH NDUFAF5 COQ10A NDUFA12 CYC1 MT-ND5 ECSIT MT-ND3 NDUFS7 UQCRQ NDUFS5 COX7A2L NDUFB4 COX11 COX20 UQCRC2 MT-ND4 NDUFS1 NDUFAF3 UQCR10 SDHD MT-ND2 NDUFB5 NDUFB2 ETFB MT-CO3
"Respiratory electron transport, ATP synthesis by chemiosmotic coupling, and heat production by uncoupling proteins."	0.629337066293371	0.787496560261329	0.418752497785021	0.963298627257223	6293	125	ACAD9 LRPPRC SDHA TIMMDC1 NDUFV1 NDUFB6 NDUFA10 COX4I1 NDUFB11 ATP5F1B ETFA SURF1 COA1 NDUFA11 SCO1 NDUFB1 UQCRC1 ETFDH COX6A1 ATP5MG NDUFA2 UQCR11 COX6C NDUFS8 NDUFAF7 NDUFA13 NDUFC1 MT-ND1 ATP5PB TRAP1 COX5B UQCRH NDUFAF5 COQ10A NDUFA12 CYC1 MT-ND5 ATP5PD ECSIT ATP5MC2 DMAC2L MT-ND3 NDUFS7 MT-ATP6 UQCRQ NDUFS5 MT-ATP8 COX7A2L NDUFB4 COX11 COX20 UQCRC2 MT-ND4 ATP5ME NDUFS1 NDUFAF3 ATP5F1A UQCR10 SDHD MT-ND2 NDUFB5 NDUFB2 ETFB MT-CO3 MT-CO2 NDUFAF2 TMEM186 NDUFAF4 NUBPL NDUFA4 ATP5F1C SLC25A14 NDUFA5 NDUFA8 MT-CYB MT-CO1 ATP5PO NDUFB9 UCP3 SLC25A27
"Response of EIF2AK1 (HRI) to heme deficiency"	0.737926207379262	0.843666695152099	0.403601639602755	0.836313393123902	7379	15	EIF2S3 EIF2S1 ASNS CEBPB ATF4 DDIT3 CEBPG
"Response of EIF2AK4 (GCN2) to amino acid deficiency"	0.0098990100989901	0.134637659829523	0.560502890402054	1.27961931047457	98	100	RPS24 GCN1 RPL18A RPL35 RPL22L1 RPS21 RPS9 RPS6 RPL24 RPL22 RPL7A RPL15 RPL6 IMPACT RPL3 RPLP0 RPL27A RPS3 RPS14 RPL26 RPL17 RPL29 RPS26 RPSA RPS8 RPL35A RPL8 RPL10A RPL10 UBA52 RPS29 RPL32 RPL31 EIF2S3 RPL9 RPS3A EIF2S1 RPL13A RPS20 RPL10L RPS13 RPL28 RPL5 RPL21 RPS2 RPL12 RPLP2 RPS15A RPL4 RPS18 RPS17 RPL38 ASNS RPL30 EIF2AK4
"Response of Mtb to phagocytosis"	0.107789221077892	0.399167530055505	0.603912909839518	1.28127973783609	1077	21	RAB7A ENO1 KPNB1 UBC KPNA1 DUSP16 HGS UBA52 UBB SFPQ ATP6V1H TRIM27 PGK1 RAB5A RNF213
"Response to elevated platelet cytosolic Ca2+"	0.0102989701029897	0.137755837675901	0.552497143906602	1.26530853094743	102	109	ACTN1 FLNA GAS6 STXBP2 TUBA4A VCL LEFTY2 ALDOA THBS1 VEGFA PDGFA STXBP3 OLA1 CHID1 F8 TLN1 APLP2 APP TGFB2 FERMT3 ANXA5 CDC37L1 PLEK ITIH4 EGF GTPBP2 CFL1 CYRIB
"Response to metal ions"	0.804219578042196	0.884934950394102	0.369973832752442	0.738514910747861	8042	9	MT3 CSRP1 MT1E MT1M MTF1 MT2A
"Retinoid cycle disease events"	0.993700629937006	0.998412596756853	0.097825514663297	0.189836155245845	9937	6	RDH5 LRAT RBP1 ABCA4 NAPEPLD STRA6
"Retinoid metabolism and transport"	0.747025297470253	0.849253225780191	0.400606208099212	0.867170671664315	7470	30	LRP1 HSPG2 LRP8 GPC6 BCO2 LRP10 GPC4 APOA1 PLB1 GPC5 SDC3 AGRN RDH11
"Retrograde neurotrophin signalling"	0.0325967403259674	0.234871155741569	0.718657191119388	1.47597457341601	325	13	AP2M1 CLTC DNM1 DNM2 CLTA AP2A1 DNAL4
"Retrograde transport at the Trans-Golgi-Network"	0.200679932006799	0.501121846578229	0.51238707260405	1.13699323677176	2006	49	VPS51 ARFIP2 ARFRP1 GCC2 VPS53 RGP1 RAB9A IGF2R COG8 RAB6B NAA38 STX16 COG1 COG6 ARL1 RIC1 VTI1A GOLGA4 VAMP3
"Reuptake of GABA"	0.97020297970203	0.990245115454728	0.142826068883563	0.270889042078293	9702	4	SLC6A12 SLC6A13 SLC6A1 SLC6A11
"Rev-mediated nuclear export of HIV RNA"	0.11008899110089	0.402606416095551	0.562501443590673	1.22818144073983	1100	35	RANGAP1 XPO1 NUP85 NUP93 NUP214 NUP58 NUP54 NUP88 NUP42 POM121C TPR RCC1 POM121 SEC13 NUP50 RANBP2 RANBP1 NUP37 NUP160 RAN NUP98 SEH1L
"Reversal of alkylation damage by DNA dioxygenases"	0.341365863413659	0.604749982518088	0.586186040990516	1.148975894954	3413	7	ASCC3 ASCC2 FTO ALKBH2 ASCC1
"Reverse Transcription of HIV RNA"	0.410658934106589	0.653588744868126	0.582692915043689	1.17468940978553	4106	1	PPIA
"Reversible hydration of carbon dioxide"	0.723927607239276	0.838177301351644	0.412318457315024	0.816417981288981	7239	8	CA5B CA12 CA2 CA13
"Rhesus blood group biosynthesis"	0.993100689931007	0.998412596756853	0.0403221561299153	0.0761372537704891	9931	2	RHD RHCE
"Rhesus glycoproteins mediate ammonium transport."	0.973902609739026	0.992765565548708	0.0799599936832132	0.150982360936518	9739	2	RHCG RHBG
"Ribosomal scanning and start codon recognition"	0.0102989701029897	0.137755837675901	0.606336473480028	1.35507885515294	102	57	EIF4G1 RPS24 EIF3G RPS21 RPS9 RPS6 EIF4A1 EIF3E EIF5 EIF3I EIF4E EIF3F EIF3L EIF3C RPS3 RPS14 EIF4B RPS26 RPSA RPS8 RPS29 EIF2S3 EIF3A RPS3A EIF3B EIF2S1 RPS20 RPS13 RPS2 RPS15A RPS18 RPS17
"Role of ABL in ROBO-SLIT signaling"	0.454454554544546	0.685429777917731	0.529493475951512	1.04843231505336	4544	8	CLASP2 ABL2 ABL1 CLASP1 CAP1
"Role of LAT2/NTAL/LAB on calcium mobilization"	0.279072092790721	0.562499766620848	0.567908286232165	1.16636722051764	2790	13	PIK3CB FYN PDPK1 GRB2 SYK GAB2 SHC1
"Role of phospholipids in phagocytosis"	0.115088491150885	0.407949102600721	0.604523131062167	1.27881929530658	1150	20	PRKCE PLCG1 PIK3CB AHCYL1 PRKCD PLA2G6 SYK
"Role of second messengers in netrin-1 signaling"	0.285371462853715	0.5676945863343	0.611313775824451	1.19822845233356	2853	7	PLCG1 TRPC1 NTN1 PITPNA
"S Phase"	0.0333966603339666	0.239920815040158	0.509586194531807	1.18002626470967	333	160	AKT2 TFDP2 CDC27 GSK3B PSMD9 PSMD6 PSMD2 CDKN1A CCND1 PSMC1 MCM2 CDC16 ANAPC2 RBBP4 PSMB9 PSMB8 UBC ANAPC5 PSMB4 TFDP1 AKT3 SMC1A MNAT1 MAX WEE1 PSMD4 PSMD11 PSMC4 ORC3 ANAPC1 PSMB10 CCNE1 MCM7 RBX1 PDS5B UBA52 PSMB7 PSME3 RPA1 ANAPC7 AKT1 POLD1 CDC25B STAG1 PSMA7 RBL2 PSMC2 PSMD7 UBB E2F1 PSMD12 ORC2 PSMD13 UBE2E1 POLD2 LIN52 PSMC3 ESCO1 PSMC6 PSMA5 POLD3 PSMF1 PSMD1 MYC RFC1 ANAPC15 GINS1 GINS3 ANAPC11 CDC23 ANAPC16 PDS5A MCM4 PSMA6 CDK4 PSMA3
"S33 mutants of beta-catenin aren't phosphorylated"	0.196780321967803	0.498480058536203	0.590568146741463	1.22373152685497	1967	15	GSK3B PPP2R5C CSNK1A1 PPP2R1A APC PPP2R5E PPP2CA CTNNB1 AXIN1 PPP2R5B AMER1
"S37 mutants of beta-catenin aren't phosphorylated"	0.196780321967803	0.498480058536203	0.590568146741463	1.22373152685497	1967	15	GSK3B PPP2R5C CSNK1A1 PPP2R1A APC PPP2R5E PPP2CA CTNNB1 AXIN1 PPP2R5B AMER1
"S45 mutants of beta-catenin aren't phosphorylated"	0.196780321967803	0.498480058536203	0.590568146741463	1.22373152685497	1967	15	GSK3B PPP2R5C CSNK1A1 PPP2R1A APC PPP2R5E PPP2CA CTNNB1 AXIN1 PPP2R5B AMER1
"SARS-CoV Infections"	0.0028997100289971	0.0816302090721161	0.552690770187304	1.27821001209291	28	152	AP2M1 ITGB1 MTA1 DDX5 JAK1 GSK3B VCP BRD4 ZCRB1 VEGFA IMPDH1 RBBP4 HDAC2 NR3C1 UBC COMT MGAT4A PRKCSH MAN2A1 FNTB ARID4B MAP1LC3B ST6GALNAC4 ST6GAL1 PARP6 GANAB IMPDH2 CHMP6 TUSC3 ST6GALNAC2 PIK3R4 GATAD2B SRPK2 MAN1B1 CSNK1A1 CHD4 RBX1 CUL3 MTA3 TYK2 UBA52 GALNT1 ST3GAL4 FKBP1A RBBP7 SIGMAR1 SUMO1 BECN1 UBB IFNAR1 TBK1 PARP10 FNTA CRBN ATP1A1 KEAP1 CANX RPN1 MBD3 PTGES3 SRPK1 AP2A1 ARID4A UBE2I HDAC1 ATP1B3 ST3GAL2 JAK2
"SARS-CoV-1 Genome Replication and Transcription"	0.0267973202679732	0.220667729145453	0.870780699868193	1.65155388992651	267	4	DDX5 ZCRB1
"SARS-CoV-1 Infection"	0.0336966303369663	0.241359591851466	0.583782197002526	1.29655204443435	336	50	DDX5 GSK3B VCP ZCRB1 UBC PRKCSH MAP1LC3B ST6GALNAC4 ST6GAL1 PARP6 GANAB CHMP6 ST6GALNAC2 PIK3R4 UBA52 GALNT1 ST3GAL4 SUMO1 BECN1 UBB PARP10 CANX
"SARS-CoV-2 Genome Replication and Transcription"	0.0267973202679732	0.220667729145453	0.870780699868193	1.65155388992651	267	4	DDX5 ZCRB1
"SARS-CoV-2 Infection"	0.036996300369963	0.252190379847809	0.553826862780075	1.24843231632628	369	71	DDX5 GSK3B VCP ZCRB1 UBC MGAT4A PRKCSH MAN2A1 MAP1LC3B ST6GALNAC4 ST6GAL1 PARP6 GANAB CHMP6 TUSC3 ST6GALNAC2 PIK3R4 SRPK2 MAN1B1 CSNK1A1 UBA52 GALNT1 ST3GAL4 SUMO1 BECN1 UBB PARP10 CANX RPN1 SRPK1
"SCF(Skp2)-mediated degradation of p27/p21"	0.0494950504949505	0.2951416680992	0.557709598250625	1.24864646906591	494	60	PSMD9 PSMD6 PSMD2 CDKN1A CCND1 PSMC1 PSMB9 PSMB8 UBC PSMB4 PSMD4 PSMD11 PSMC4 PSMB10 CCNE1 UBA52 PSMB7 PSME3 PSMA7 PSMC2 PSMD7 UBB PSMD12 PSMD13 PSMC3 PSMC6 PSMA5 PSMF1
"SCF-beta-TrCP mediated degradation of Emi1"	0.0797920207979202	0.360855518925719	0.550372358210318	1.22538384743917	797	53	PSMD9 PSMD6 PSMD2 PSMC1 PSMB9 PSMB8 UBC PSMB4 PSMD4 PSMD11 PSMC4 PSMB10 UBA52 PSMB7 PSME3 PSMA7 PSMC2 PSMD7 UBB PSMD12 PSMD13 PSMC3 PSMC6 PSMA5 PSMF1
"SDK interactions"	0.536146385361464	0.737499503882661	0.51606409422496	0.974444490945577	5361	2	SDK2 SDK1
"SEMA3A-Plexin repulsion signaling by inhibiting Integrin adhesion"	0.0372962703729627	0.252190379847809	0.704695438483591	1.45335173575147	372	14	PLXNA3 FARP2 PLXNA1 PLXNA4 TLN1 FYN FES PLXNA2 SEMA3A RAC1
"SHC-mediated cascade:FGFR1"	0.375662433756624	0.630600752079488	0.547658209042974	1.10188486877312	3756	10	FGFR1 GRB2 KRAS NRAS SHC1
"SHC-mediated cascade:FGFR2"	0.445255474452555	0.682687462729345	0.511911583373272	1.04590065209024	4452	12	FGFR2 GRB2 KRAS NRAS SHC1
"SHC-mediated cascade:FGFR3"	0.624237576242376	0.785488135178166	0.450847390135471	0.914588127661664	6242	11	GRB2 KRAS NRAS SHC1
"SHC-mediated cascade:FGFR4"	0.611838816118388	0.776469522859035	0.453800960149349	0.927173237635633	6118	12	GRB2 KRAS NRAS SHC1
"SHC-related events triggered by IGF1R"	0.120887911208879	0.415723910563489	0.679162478057765	1.35569484234778	1208	9	IGF1R GRB2 KRAS NRAS IGF1 IGF2 SHC1
"SHC1 events in EGFR signaling"	0.357064293570643	0.618330738354736	0.536203991140348	1.10585787658513	3570	14	GRB2 EGF KRAS NRAS SHC1 EREG
"SHC1 events in ERBB2 signaling"	0.0417958204179582	0.269833816618338	0.650977871812367	1.38113417239995	417	21	ERBB2 PRKCE ERBB3 PRKCD ERBB4 GRB2 EGF KRAS NRAS PTPN12 SHC1 EREG
"SHC1 events in ERBB4 signaling"	0.454754524547545	0.685429777917731	0.506615198132541	1.04048378029174	4547	13	ERBB4 GRB2 KRAS NRAS SHC1 EREG
"SHOC2 M1731 mutant abolishes MRAS complex function"	0.373462653734627	0.628320420216491	0.563821869488413	1.11640481847897	3734	8	MRAS PPP1CC BRAF PPP1CB RAF1
"SIRT1 negatively regulates rRNA expression"	0.781021897810219	0.869358167631513	0.390172141404778	0.846274081489344	7810	31	H2BC11 TAF1D TAF1C RRP8 TAF1B H2BC15 H2BC4 H3-3A H2BC12 H3C15 H2BC17 H2AZ2 TAF1A
"SLBP Dependent Processing of Replication-Dependent Histone Pre-mRNAs"	0.593540645935407	0.767046987937279	0.46269682278382	0.938625863394036	5935	11	NCBP2 SNRPG SLBP ZNF473 SNRPB NCBP1 LSM10 SNRPE
"SLBP independent Processing of Histone Pre-mRNAs"	0.64003599640036	0.79381513692893	0.447951264451799	0.901275123967862	6400	10	NCBP2 SNRPG ZNF473 SNRPB NCBP1 LSM10 SNRPE
"SLC transporter disorders"	0.0791920807919208	0.359707368850357	0.526433403982169	1.1914544358648	791	79	SLC35A3 CP SLC40A1 SLC2A1 NUP85 NUP93 NUP214 NUP58 NUP54 SLC33A1 SLC2A10 NUP88 SLC35A1 NUP42 POM121C TPR BSG SLCO2A1 POM121 SLC11A2 SEC13 SLC3A1 NUP50 RANBP2 SLC34A2 SLC20A2 NUP37
