pathway	pval	padj	ES	NES	nMoreExtreme	size	leadingEdge
"Defects in vitamin and cofactor metabolism"	0.194080591940806	0.497215992686446	0.565149811480479	1.19903878604657	1940	21	ABCD4 MMAB LMBRD1 PCCB HLCS BTD ACACA MCCC2 CD320 MTRR MMADHC MMACHC PC MCCC1
"Defects of contact activation system (CAS) and kallikrein/kinin system (KKS)"	0.608539146085392	0.774184588897915	0.464394480751236	0.91953197284834	6085	8	F8 TPST1
Defensins	0.411658834116588	0.653954092779698	0.588522742251539	1.11621332951324	4116	4	PRSS2 DEFB105A
"Degradation of AXIN"	0.0510948905109489	0.300244490114095	0.566592421516631	1.26149722283583	510	53	PSMD9 PSMD6 PSMD2 PSMC1 PSMB9 PSMB8 UBC PSMB4 PSMD4 PSMD11 PSMC4 PSMB10 RNF146 UBA52 PSMB7 PSME3 PSMA7 SMURF2 PSMC2 PSMD7 UBB PSMD12 PSMD13 PSMC3 PSMC6 PSMA5 PSMF1 AXIN2 PSMD1 PSMA6 AXIN1 PSMA3
"Degradation of DVL"	0.0171982801719828	0.180005076415435	0.598442958408047	1.3338146648248	171	54	PSMD9 PSMD6 PSMD2 PSMC1 PSMB9 PSMB8 UBC PSMB4 DVL2 DVL3 PSMD4 PSMD11 PSMC4 DVL1 PSMB10 RBX1 CUL3 UBA52 PSMB7 PSME3 PSMA7 PSMC2 PSMD7 UBB PSMD12 PSMD13 PSMC3 PSMC6 PSMA5 PSMF1
"Degradation of GABA"	0.253674632536746	0.543126953795386	0.727641206506291	1.37394942411158	2536	2	ALDH5A1 ABAT
"Degradation of GLI1 by the proteasome"	0.0411958804119588	0.26882810371254	0.56964719603042	1.27223909411699	411	56	PSMD9 PSMD6 PSMD2 PSMC1 PSMB9 PSMB8 UBC PSMB4 PSMD4 PSMD11 PSMC4 PSMB10 RBX1 NUMB UBA52 PSMB7 PSME3 PSMA7 PSMC2 PSMD7 UBB PSMD12 PSMD13 PSMC3 PSMC6 PSMA5 ITCH PSMF1
"Degradation of GLI2 by the proteasome"	0.0286971302869713	0.226305382491067	0.577283448400119	1.29014932891471	286	57	GSK3B PSMD9 PSMD6 PSMD2 PSMC1 PSMB9 PSMB8 UBC PSMB4 PSMD4 PSMD11 PSMC4 PSMB10 CSNK1A1 RBX1 UBA52 PSMB7 PSME3 PSMA7 PSMC2 PSMD7 UBB PSMD12 PSMD13 PSMC3 PSMC6 PSMA5 PSMF1
"Degradation of beta-catenin by the destruction complex"	0.0267973202679732	0.220667729145453	0.551532593966327	1.25056161738323	267	83	GSK3B PSMD9 PSMD6 PSMD2 TLE2 TLE1 PSMC1 PSMB9 PPP2R5C PSMB8 UBC PSMB4 PSMD4 PSMD11 PSMC4 PSMB10 CSNK1A1 RBX1 UBA52 PSMB7 PSME3 CTBP2 TCF7L1 PSMA7 PSMC2 CTBP1 PSMD7 PPP2R1A UBB PSMD12 PSMD13 PSMC3 PSMC6 PSMA5 APC TLE5 PSMF1 HDAC1 AXIN2 PPP2R5E PPP2CA PSMD1 CTNNB1 FRAT2 MYC TLE3 PSMA6 AXIN1 PSMA3 PSMB5 FRAT1 PPP2R5B
"Degradation of cysteine and homocysteine"	0.5002499750025	0.719610926607874	0.49269738837601	1.00664360120539	5002	12	TSTD1 GADL1 CTH GOT2 SLC25A10 CSAD ADO TXN2 SUOX
"Degradation of the extracellular matrix"	0.003999600039996	0.0998250690394878	0.596507250413571	1.35158836287874	39	81	CTSB CDH1 BMP1 COL26A1 LAMA5 CD44 ADAM9 CAPN13 CAST HSPG2 COL9A3 ADAM17 COL12A1 CTSD MMP24
"Deletions in the AMER1 gene destabilize the destruction complex"	0.327967203279672	0.599251772935914	0.667912411832825	1.34648906240005	3279	1	AMER1
"Deletions in the AXIN genes in hepatocellular carcinoma result in elevated WNT signaling"	0.288371162883712	0.569648173844932	0.706390146331193	1.42405888702094	2883	1	AXIN1
"Depolymerisation of the Nuclear Lamina"	0.429257074292571	0.670136644872098	0.508764642336489	1.05422437022972	4292	15	LMNB1 TMPO LEMD2 LPIN3 CTDNEP1 LPIN2 CCNB1
"Deposition of new CENPA-containing nucleosomes at the centromere"	0.562543745625438	0.751610600529351	0.44079342033839	0.975108914755617	5625	46	RBBP4 H2BC11 CENPT ITGB3BP RSF1 CENPC CENPP RBBP7 RUVBL1 CENPN H2BC15 H2BC4 H2BC12 CENPK MIS18BP1
Depurination	0.857314268573143	0.919609146750367	0.362609476431614	0.784921194109841	8573	30	H2BC11 ACD TINF2 H2BC15 H2BC4 H2BC12 OGG1 TERF2IP H2BC17 MUTYH H2AZ2 TERF1 TERF2
Depyrimidination	0.881911808819118	0.935432606542237	0.355095609567428	0.77532572107721	8819	35	H2BC11 ACD MBD4 TINF2 H2BC15 H2BC4 H2BC12 UNG OGG1 TERF2IP H2BC17 SMUG1 H2AZ2 TERF1 NEIL1 TERF2
"Deregulated CDK5 triggers multiple neurodegenerative pathways in Alzheimer's disease models"	0.401559844015598	0.649416421083343	0.501953561554204	1.06184175076232	4015	20	LMNB1 CAST APP SOD2 CDC25C CDC25B BCL2L11 YWHAE CDK5R1 CAPN1
"Dermatan sulfate biosynthesis"	0.685531446855315	0.820806940077506	0.429816539912665	0.851065349160459	6855	8	BGN CSPG4 DCN CSPG5 DSE
"Detoxification of Reactive Oxygen Species"	0.361263873612639	0.619303440680667	0.493526526326245	1.07246229125836	3612	32	TXNRD2 NOX4 CYBB ERO1A TXNRD1 SOD2 GSR P4HB CCS
Deubiquitination	0.0062993700629937	0.126039462169486	0.510730132831096	1.19659879972329	62	251	ATXN7 TP53 USP19 DDX58 USP9X USP33 USP34 SMAD3 RNF123 ARRB2 PSMD9 PSMD6 PSMD2 VCP IDE USP4 MYSM1 TRRAP PSMC1 BABAM1 ASXL1 PSMB9 PSMB8 UBC H2BC11 USP24 AR PSMB4 BAP1 IKBKG RHOA USP30 ADRM1 MAP3K7 INO80C NFKBIA CYLD PSMD4 PSMD11 PSMC4 KDM1B PSMB10 USP2 RNF146 UCHL1 OTUD3 BARD1 HGS USP15 FOXO4 UBA52 USP48 WDR48 PSMB7 EP300 PSME3 USP47 MBD5 USP22 BRCC3 ATXN3 FOXK2 PSMA7 MBD6 SMURF2 PSMC2 PSMD7 BECN1 UBB OTUD5 ACTR8 PSMD12 UIMC1 PSMD13 USP14 UCHL5 H2AC21 RUVBL1 USP7 KEAP1 PSMC3 USP25 SMAD2 PSMC6 NEDD8 TOMM70 SNX3 PSMA5 APC PSMF1 USP42 ACTB INO80E ACTL6A VDAC2 USP21 H2BC15 AXIN2 TNIP1 TRIM25 JOSD1 SMAD4 OGT PSMD1 H2BC4 MYC PTRH2 H2AC11
"Developmental Biology"	9.99900009999e-05	0.0121037896210379	0.515819658432703	1.23109558208007	0	825	WT1 EIF4G1 ERBB2 SPTAN1 VAV3 AKT2 TFDP2 AP2M1 ITGB1 MEIS1 KMT2C ZSWIM8 DLG1 RPS24 AJUBA GATA2 GRB7 USP33 ARHGEF7 MEF2D EPHB6 RPL18A SMARCA4 ACTR3 LAMA1 PLXNA3 WWTR1 PLCG1 POLR2B RPL35 GSK3B CLTC RPL22L1 NCOR2 SMAD3 PSMD9 DNM1 PSMD6 DNM2 PSMD2 PTK2 TGM1 CDKN1A FARP2 SPAG9 RPS21 ABLIM1 LEFTY2 CCNC EPAS1 RPS9 RPS6 PLXNB1 HSPA8 PIK3CB RPS6KA1 PSMC1 RPL24 RPL22 RPL7A RPL15 DPYSL2 DSG2 PTGDS UPF3A CACNA1D POLR2H RBBP4 HDAC2 PSMB9 EPHB1 CSNK2A1 PSMB8 KRT19 PRSS8 KRT7 MED14 KRT86 MYH14 CDC42 NCK1 UBC PLXNA1 EVL H2BC11 MED9 CTNNA1 RPL6 ZNF638 ANK2 PLXNA4 COL9A3 MYL9 TCF4 PSMB4 TBL1XR1 RPL3 RPLP0 MED13L TFDP1 NCOR1 AKT3 ANGPTL4 CSNK2B RHOA RPS6KA5 FGFR1 ITGAV FOXP1 SMARCD3 CDH2 MAML3 MED22 TLN1 MED17 MYL6 COL4A2 RPL27A DPYSL3 PSMD4 KLK5 RPS3 KDM6A PLXNC1 CCND3 MED15 HIF3A MAMLD1 RPS14 PSMD11 POLR2C RPL26 MED26 TBL1X RPL17 ARHGEF12 CREBBP PSMC4 TSC22D1 SLIT3 APH1A SPTBN2 TRPC1 RPL29 MED25 PKP4 PSMB10 BOC EVPL UNC5B NTN4 FYN KMT2A LYPLA2 HDAC3 CLASP2 NCBP2 ARHGEF28 RPS26 RBX1 LIMK1 RPSA ABL2 RET DSC2 RPS8 KALRN GRB2 GSPT2 RPL35A EZH2 NUMB SEMA6A RPL8 POLR2F YES1 RPL10A RPL10 EFNA1 ZNF467 SDCBP TEAD1 UTRN CLTA UBA52 STX1A SOS2 RPS29 PSMB7 POLR2G EP300 SALL1 PSME3 PTPRC RPL32 NRCAM CFL1 RPL31 VASP FES EPHA2 ACVR2B CACNB2 THRAP3 AKT1 CACNB1 RPL9 PLXNA2 RPS3A MYL12B PDLIM7 KRAS PSMA7 RBBP7 TCF12 KRT23 PSMC2 PSMD7 GAB2 EED UBB ARPC2 MED27 ZNF335 E2F1 PSMD12 PSEN2 COL9A2 SHC3 PSMD13 ALCAM NRAS RPL13A RPS6KA4 NCOA3 UNC5C RNPS1 LAMC1 CBFB GSC RPS20 ARPC5 PSMC3 MAPK8 RELA SPINK5 MET SMAD2 PKNOX1 ABL1 RPL10L PSMC6 ASH2L MYL12A POLR2A SEMA3A SEMA5A PI3 CDK19 RAC1 PSMA5 RPS13 RPL28 RPL5 RGMA RPL21 SCD5 AP2A1 RPS2 KAZN SPI1 POLR2E CDON RPL12 PSMF1 ACTB RPLP2 ACVR1C MED6 SIAH1 CHD9 MAGOHB RPS15A RPL4 SPTBN4 H2BC15 RPS18 RPS17 VAV2 SMAD4 SRGAP2 NFASC PPARGC1A RPL38 MAFB PSMD1 H2BC4 CTNNB1 ARPC4 CSNK2A2 MYC RPL30 EPHA7
Digestion	0.482751724827517	0.70654049052926	0.547444282572939	1.03830245036233	4827	4	AMY2B CEL
"Digestion and absorption"	0.866813318668133	0.925696975957455	0.319449828370786	0.626149595485101	8668	7	AMY2B CEL SLC2A5
"Digestion of dietary carbohydrate"	0.477052294770523	0.704381513068205	0.559184086237347	1.05586468494142	4770	2	AMY2B MGAM
"Digestion of dietary lipid"	0.334366563343666	0.602399760023998	0.661280134751026	1.33311861383339	3343	1	CEL
"Dimerization of procaspase-8"	0.592040795920408	0.766853672730001	0.466354386645956	0.938302089964336	5920	10	CFLAR CASP8 FAS TRAF2
"Disassembly of the destruction complex and recruitment of AXIN to the membrane"	0.13998600139986	0.445929091301396	0.562856012757543	1.21550966024897	1399	29	GSK3B PPP2R5C DVL2 DVL3 LRP5 DVL1 CSNK1A1 PPP2R1A APC PPP2R5E PPP2CA CTNNB1 FRAT2 CAV1 AXIN1 FRAT1 PPP2R5B AMER1
Disease	9.99900009999e-05	0.0121037896210379	0.5089675350257	1.22036018815204	0	1396	HDAC9 ERBB2 CDH1 VAV3 SLC35A3 AKT2 CP ANTXR1 MUC1 TFDP2 AP2M1 LRRFIP1 MRAS ITGB1 TP53 TLR3 AP1M1 CDKN2A ALG3 TSC2 TPM4 PRKAR1A SLC40A1 IQGAP1 PPFIBP1 RPS24 VCL MTA1 DYNC1H1 DDX5 GALE CDC27 MC1R RPL18A ACTR3 NEDD4L GNAI2 CDKN1C PRKX MSH2 CTSA JAK1 RAP1B PLCG1 POLR2B RPL35 BAIAP2 GSK3B CLTC IPO5 RPL22L1 NCOR2 NMT1 SMAD3 ARRB2 PSMD9 NOXA1 PSMD6 ABCD4 PSMD2 PTK2 VCP IRAK4 RANGAP1 XPO1 IL18 CDKN1A GNB1 RPS21 APOBEC3G SV2A BRD4 ZCRB1 CPSF4 FIP1L1 SLC2A1 CCNC OS9 MPRIP C1GALT1 WRN RPS9 RAB7A ATRX NOX4 JAG1 RPS6 THBS1 CCND1 PIK3CB DYNC1I2 ENO1 KPNB1 GCC2 NUP85 PSMC1 RPL24 PORCN RPL22 VEGFA RPL7A RPL15 PSIP1 NCKAP1 LMO7 KLC1 LFNG IMPDH1 CDC16 PDGFA POLR2H GNE ANAPC2 RBBP4 TAF4B HDAC2 PSMB9 PPP2R5C PSMB8 TRAK1 POMT2 HIP1 LMNB1 MIB1 CDC42 NCK1 CAST NR3C1 UBC TAF15 NUP93 H2BC11 BCL2L1 ANAPC5 GAA NUP214 CTNND1 MMAB DNMT3A SV2C COMT RPL6 ABI2 ATM MGAT4A HSPG2 FGFR1OP2 AP1G1 ALG6 CASP1 PRKCSH ERBB3 ACY1 FGFR2 PSMB4 MAN2A1 FNTB DVL2 ADAM17 ARID4B TBL1XR1 RPL3 RPLP0 TFDP1 NUP58 MAP1LC3B NCOR1 AKT3 DVL3 NCKAP1L HMGB1 NUP54 IKBKG ERLIN2 POMT1 FGFR1 LMBRD1 PABPN1 DOCK2 MNAT1 VPS37A PCCB F8 SLC33A1 NT5E ST6GALNAC4 MAML3 ST6GAL1 NFKBIA TLN1 PARP6 TRIM24 SYVN1 APP RPL27A PSMD4 RPS3 RAD51C TXNRD1 CCND3 GANAB SLC2A10 MAMLD1 AP1S2 RPS14 PSMD11 ADAMTS20 GTF2H5 POLR2C GPS2 RPL26 TBL1X RPL17 IMPDH2 PMM2 CHMP6 DPM3 CREBBP TUSC3 LRP5 ADCY7 PSMC4 DVL1 TAF12 CAMK2G ANAPC1 NUP88 ABCC9 KPNA1 APH1A ST6GALNAC2 KPNA5 PDCD6IP DUSP7 PIK3R4 DUSP16 GATAD2B RPL29 GSS AP1M2 SRPK2 AHCY MAN1B1 PRKAR2B CTDP1 SFTPD CUX1 PSMB10 HGSNAT SLC35A1 NUP42 MARK3 POM121C AHCYL1 CSNK1A1 CCNE1 CASP8 SEC31A CNKSR1 FYN DHDDS BARD1 ABCA12 HDAC3 TPR SOD2 SPON1 RNGTT PDPK1 NCBP2 HGS ERBB4 CHD4 RPS26 RBX1 RPSA RFT1 RPS8 GRB2 RPL35A EZH2 CUL3 NF1 RPL8 POLR2F CHMP1A YES1 RPL10A BSG MTA3 DNAJC3 HDAC8 GNB2 RPL10 TYK2 DUSP9 FOXO4 CDC25C NOTCH2 NUS1 MAP2K7 ZC3HAV1 EGF ALG13 GNB4 GCLC NELFA CLTA UBA52 GALNT1 STX1A SGSH RCC1 GNAS P2RY11 RPS29 VPS37D ST3GAL4 WDR48 RMI2 PSMB7 GNS POLR2G CEP43 SLCO2A1 EP300 POM121 MECP2 PSME3 RPL32 EIF2AK3 FKBP1A BGN RPL31 ABCB6 SLC11A2 GALT CTBP2 ANAPC7 SYK PAPSS2 AKT1 RPL9 NELFE HLCS PLK2 RPS3A PGM1 CSK BTD GNG5 CDC25B ACACA PPM1B KRAS FBXW7 PSMA7 RBBP7 SIGMAR1 GPC6 PSMC2 MAPKAP1 CTBP1 SEC13 PTH2R RAC2 LARGE1 PSMD7 SUMO1 BECN1 GAB2 TENT4A PPP2R1A EED MVB12A UBB ARPC2 GOLGA4 IFNAR1 CSPG4 E2F1 ELMO1 ALG8 EML4 PSMD12 PSEN2 SLC25A4 AGK TBK1 PARP10 FNTA MUC5B DYNLL1 SLC3A1 PSMD13 SFPQ GTF2E2 NRAS RPL13A UBE2E1 JAG2 H2AC21 TAF1 TCEA1 CUL5 KHK LIG4 RPS20 ARPC5 CRBN ATP1A1 RAD50 KEAP1 SNF8 DPM2 CANX PSMC3 MAPK8 RPN1 RELA PPP1CC MET MBD3 MCCC2 GPR176 NUP50 QKI SMAD2 TFG PTGES3 SRPK1 SLC35D1 RANBP2 ABL1 SND1 CYFIP2 RPL10L PSMC6 POLR2A RRBP1 SEMA5A GUSB NEURL1B SLC34A2 CD320 ESRP1 BCL2L11 RAC1 SLC20A2 MYD88 PSMA5 RPS13 RPL28 RPL5 WASF1 VAMP2 EEF2 CHUK APC EXT2 RPL21 CDK6 AP2A1 RANBP1 RPS2 NELFB NUP37 GALNT3 GYG1 CYP2R1 APBB1IP TBXAS1 POLR2E TAF13 RPL12 PSMF1 ACTB PTPN12 ARID4A RPLP2 ATIC MAP3K11 UBE2I CALM1 HDAC1 RPS15A ATP1B3 GTF2H1 RPL4 H2BC15 RPS18 RPS17 TPM3 SLC29A3 ST3GAL2 VAV2 AP1S3 MTRR PRKAR1B YWHAE SMAD4 JAK2 CLCN6 PPP2R5E FXR1 XRCC5 RPL38 TOP3A PPP2CA PSMD1 H2BC4 GTF2E1 DNMT1 GNAI1 CTNNB1 ARPC4 ERLIN1 MYC EPS15 RPL30 NMT2 MMADHC MYO10 CARS1 ANAPC15 GLP1R CASP9 ATP6V1H MVB12B CDK8 H2AC11 AP1S1 PARP9 SHC1 CCNK GPC4 BRAF ARF1 H3-3A PIM1 MGAT4B H2BC12 MTOR ADAMTS2 ADAMTS12 TRIM28 NCKIPSD CREB1 ANAPC11 ALG2 MMACHC NUP160 ARPC1B FRS2 BRCA1 PPP1CB SLC12A6 EREG RAN ENTPD5 TRIM27 NELFCD CHMP4A POMGNT1 CDC23 ANAPC16 SUDS3 RPL39L ARRB1
"Diseases associated with N-glycosylation of proteins"	0.201679832016798	0.501815902685168	0.57867821124121	1.20820818209158	2016	17	ALG3 ALG6 MAN1B1 RFT1 ALG13 ALG8 ALG2 ALG11 ALG9
"Diseases associated with O-glycosylation of proteins"	0.37006299370063	0.626519236188269	0.469493283546955	1.05000758106826	3700	58	MUC1 C1GALT1 THBS1 LFNG POMT2 POMT1 ADAMTS20 SPON1 NOTCH2 LARGE1 MUC5B SEMA5A GALNT3 ADAMTS2 ADAMTS12 POMGNT1 THSD7A SBSPON
"Diseases associated with glycosaminoglycan metabolism"	0.812818718128187	0.890019953228558	0.381314715521002	0.831038955827768	8128	34	HSPG2 BGN PAPSS2 GPC6 CSPG4 EXT2 GPC4 B3GAT3 HEXB B4GALT7 GPC5 B3GALT6 SDC3 AGRN ST3GAL3 CHST6 HEXA
"Diseases associated with glycosylation precursor biosynthesis"	0.0560943905609439	0.304756131529704	0.655515235841215	1.37442389309092	560	18	GALE CTSA GNE PMM2 DPM3 DHDDS NUS1 GALT PGM1 DPM2
"Diseases associated with surfactant metabolism"	0.298570142985701	0.576297802416428	0.631750514805412	1.2149494441969	2985	5	SFTPD SLC34A2
"Diseases associated with the TLR signaling cascade"	0.123387661233877	0.420483268128883	0.581928592809781	1.24590905288058	1233	25	TLR3 IRAK4 HMGB1 IKBKG NFKBIA RELA MYD88 CHUK
"Diseases associated with visual transduction"	0.993700629937006	0.998412596756853	0.097825514663297	0.189836155245845	9937	6	RDH5 LRAT RBP1 ABCA4 NAPEPLD STRA6
"Diseases of Base Excision Repair"	0.701029897010299	0.829923413526618	0.422033636694212	0.811632947369995	7010	5	OGG1 MUTYH NEIL1 NTHL1
"Diseases of Cellular Senescence"	0.188381161883812	0.490131974987249	0.746618927144642	1.40527102791872	1883	3	CDKN2A CDK6 CDK4
"Diseases of DNA Double-Strand Break Repair"	0.678532146785322	0.814440420112674	0.420434150011968	0.898455511641084	6785	24	WRN ATM RAD51C BARD1 RMI2 RAD50 TOP3A BRCA1 RBBP8 MRE11 RAD51B KAT5 RAD51D RAD51AP1 BLM BRCA2 PALB2 NBN DNA2
"Diseases of DNA repair"	0.675932406759324	0.814145451126529	0.419085375037844	0.913356496085598	6759	34	MSH2 WRN ATM RAD51C BARD1 RMI2 RAD50 TOP3A BRCA1 RBBP8 MRE11 OGG1 MLH1 MUTYH NEIL1 RAD51B KAT5 MSH3 RAD51D RAD51AP1 BLM PMS2 BRCA2 PALB2 NBN DNA2 NTHL1
"Diseases of Immune System"	0.123387661233877	0.420483268128883	0.581928592809781	1.24590905288058	1233	25	TLR3 IRAK4 HMGB1 IKBKG NFKBIA RELA MYD88 CHUK
"Diseases of Mismatch Repair (MMR)"	0.281671832816718	0.563779153824107	0.641225071205875	1.23317041396738	2816	5	MSH2 MLH1 MSH3 PMS2
"Diseases of Telomere Maintenance"	0.146885311468853	0.44874800019998	0.8139429353846	1.53690640020356	1468	2	ATRX DAXX
"Diseases of carbohydrate metabolism"	0.527747225277472	0.732470019473697	0.456767487597885	0.990717801197586	5277	31	UBC GAA HGSNAT UBA52 SGSH GNS UBB KHK GUSB GYG1
"Diseases of cellular response to stress"	0.188381161883812	0.490131974987249	0.746618927144642	1.40527102791872	1883	3	CDKN2A CDK6 CDK4
"Diseases of glycosylation"	0.245275472452755	0.535343239869562	0.467239585073247	1.07520079364029	2452	126	MUC1 ALG3 GALE CTSA C1GALT1 THBS1 LFNG GNE POMT2 HSPG2 ALG6 POMT1 ADAMTS20 PMM2 DPM3 MAN1B1 DHDDS SPON1 RFT1 NOTCH2 NUS1 ALG13 BGN GALT PAPSS2 PGM1 GPC6 LARGE1 CSPG4 ALG8 MUC5B DPM2 SEMA5A EXT2 GALNT3 GPC4 ADAMTS2 ADAMTS12 ALG2 POMGNT1 ALG11 THSD7A SBSPON ALG9
"Diseases of hemostasis"	0.608539146085392	0.774184588897915	0.464394480751236	0.91953197284834	6085	8	F8 TPST1
"Diseases of metabolism"	0.185681431856814	0.490131974987249	0.462167688847314	1.07831732460098	1856	210	MUC1 ALG3 GALE CTSA ABCD4 C1GALT1 THBS1 LFNG GNE POMT2 UBC GAA MMAB HSPG2 ALG6 ACY1 POMT1 LMBRD1 PCCB ADAMTS20 PMM2 DPM3 GSS AHCY MAN1B1 SFTPD HGSNAT DHDDS SPON1 RFT1 NOTCH2 NUS1 ALG13 GCLC UBA52 SGSH GNS BGN GALT PAPSS2 HLCS PGM1 BTD ACACA GPC6 LARGE1 UBB CSPG4 ALG8 MUC5B KHK DPM2 MCCC2 SLC35D1 SEMA5A GUSB SLC34A2 CD320 EXT2 GALNT3 GYG1 CYP2R1 TBXAS1 MTRR MMADHC GPC4 ADAMTS2 ADAMTS12 ALG2 MMACHC POMGNT1 ALG11 THSD7A SBSPON ALG9
"Diseases of mitotic cell cycle"	0.0238976102389761	0.210385870503859	0.619045401454334	1.35538209963888	238	37	TFDP2 CDC27 CDKN1C CDKN1A ATRX CCND1 CDC16 ANAPC2 ANAPC5 TFDP1 CCND3 ANAPC1 CCNE1 ANAPC7 E2F1 UBE2E1 CDK6 ANAPC15 ANAPC11 CDC23 ANAPC16 CDK4
"Diseases of programmed cell death"	0.316868313168683	0.591471230671844	0.476234159656763	1.06872962620903	3168	64	TP53 CDKN2A RBBP4 LMNB1 CAST H2BC11 DNMT3A APP CASP8 SOD2 EZH2 CDC25C CDC25B RBBP7 EED BCL2L11 H2BC15 YWHAE H2BC4 DNMT1 H3-3A H2BC12 CDK5R1 CAPN1 H3C15 SUZ12 H2BC17 POLA2 H2AZ2 CAPNS1 C1QBP POLA1
"Diseases of signal transduction by growth factor receptors and second messengers"	9.99900009999e-05	0.0121037896210379	0.541710329349422	1.28060198810335	0	389	HDAC9 ERBB2 AKT2 LRRFIP1 MRAS TSC2 TPM4 PRKAR1A IQGAP1 PPFIBP1 VCL RAP1B PLCG1 POLR2B GSK3B CLTC NCOR2 SMAD3 ARRB2 PSMD9 PSMD6 PSMD2 VCP CDKN1A FIP1L1 CCNC OS9 MPRIP NOX4 JAG1 RPS6 PIK3CB GCC2 PSMC1 PORCN LMO7 KLC1 PDGFA POLR2H HDAC2 PSMB9 PPP2R5C PSMB8 TRAK1 HIP1 MIB1 UBC BCL2L1 FGFR1OP2 ERBB3 FGFR2 PSMB4 ADAM17 TBL1XR1 NCOR1 AKT3 ERLIN2 FGFR1 MAML3 TLN1 TRIM24 SYVN1 PSMD4 MAMLD1 PSMD11 POLR2C TBL1X CREBBP LRP5 PSMC4 CAMK2G APH1A DUSP7 DUSP16 CUX1 PSMB10 MARK3 CSNK1A1 SEC31A CNKSR1 FYN HDAC3 TPR PDPK1 NCBP2 ERBB4 RBX1 GRB2 NF1 POLR2F YES1 HDAC8 DUSP9 FOXO4 ZC3HAV1 EGF UBA52 WDR48 PSMB7 POLR2G CEP43 EP300 MECP2 PSME3 EIF2AK3 FKBP1A CTBP2 AKT1 CSK PPM1B KRAS FBXW7 PSMA7 PSMC2 MAPKAP1 CTBP1 RAC2 PSMD7 GAB2 TENT4A PPP2R1A UBB GOLGA4 EML4 PSMD12 PSEN2 AGK PSMD13 NRAS JAG2 PSMC3 PPP1CC MET QKI SMAD2 TFG RANBP2 SND1 PSMC6 POLR2A RRBP1 NEURL1B ESRP1 BCL2L11 RAC1 PSMA5 CHUK APC APBB1IP POLR2E PSMF1 PTPN12 ATIC MAP3K11 CALM1 HDAC1 TPM3 SMAD4 JAK2 CLCN6 PPP2R5E FXR1 PPP2CA PSMD1 CTNNB1 MYC CARS1 CASP9 CDK8 SHC1 BRAF PIM1
"Diseases of the neuronal system"	0.993700629937006	0.998412596756853	0.097825514663297	0.189836155245845	9937	6	RDH5 LRAT RBP1 ABCA4 NAPEPLD STRA6
"Disinhibition of SNARE formation"	0.201279872012799	0.501585026682517	0.686326873265836	1.31990783334551	2012	5	STXBP3 STX4
"Disorders of Developmental Biology"	0.082991700829917	0.366609367944072	0.667841502315013	1.3716095638778	829	13	NCOR2 TBL1XR1 NCOR1 GPS2 TBL1X HDAC3 MECP2 CALM1 HDAC1
"Disorders of Nervous System Development"	0.082991700829917	0.366609367944072	0.667841502315013	1.3716095638778	829	13	NCOR2 TBL1XR1 NCOR1 GPS2 TBL1X HDAC3 MECP2 CALM1 HDAC1
"Disorders of transmembrane transporters"	0.0061993800619938	0.125072492750725	0.536989279662272	1.24224478158763	61	153	SLC35A3 CP SLC40A1 PSMD9 PSMD6 ABCD4 PSMD2 VCP SLC2A1 OS9 NUP85 PSMC1 PSMB9 PSMB8 UBC NUP93 NUP214 PSMB4 NUP58 NUP54 ERLIN2 LMBRD1 SLC33A1 PSMD4 SLC2A10 PSMD11 PSMC4 NUP88 ABCC9 PSMB10 SLC35A1 NUP42 POM121C ABCA12 TPR BSG UBA52 PSMB7 SLCO2A1 POM121 PSME3 ABCB6 SLC11A2 PSMA7 PSMC2 SEC13 PSMD7 UBB PSMD12 SLC3A1 PSMD13 PSMC3 NUP50 RANBP2 PSMC6 SLC34A2 SLC20A2 PSMA5 NUP37 PSMF1
"Displacement of DNA glycosylase by APEX1"	0.656534346565343	0.801143978344101	0.441470771331502	0.881231910003293	6565	9	MBD4 UNG OGG1 SMUG1 MUTYH APEX1 TDG NTHL1
"Dissolution of Fibrin Clot"	0.857914208579142	0.919845127976131	0.336156112158172	0.681925627047294	8579	11	PLAU SERPINB8 ANXA2 S100A10
"Dopamine Neurotransmitter Release Cycle"	0.348865113488651	0.610611698945712	0.524314803009583	1.09933492519491	3488	18	PPFIA1 UNC13B STX1A CASK VAMP2 SYN3 RAB3A
"Dopamine clearance from the synaptic cleft"	0.0728927107289271	0.345687999293456	0.812932485394266	1.54183689269152	728	4	COMT LRTOMT
"Dopamine receptors"	0.466553344665534	0.694665219824881	0.52458153489841	1.05753881282047	4665	1	DRD4
"Downregulation of ERBB2 signaling"	0.04999500049995	0.295936176553494	0.621485843299235	1.33651605483592	499	27	ERBB2 AKT2 UBC ERBB3 AKT3 ERBB4 EGF UBA52 AKT1 PTPN18 UBB CUL5
"Downregulation of ERBB2:ERBB3 signaling"	0.018998100189981	0.188501641639115	0.753298746497009	1.53908541195381	189	12	ERBB2 AKT2 UBC ERBB3 AKT3 UBA52 AKT1 UBB
"Downregulation of ERBB4 signaling"	0.152884711528847	0.453892110788921	0.65784161924107	1.3131356915318	1528	9	UBC NEDD4 ERBB4 UBA52 UBB WWP1 ITCH SRC
"Downregulation of SMAD2/3:SMAD4 transcriptional activity"	0.0045995400459954	0.107071985109181	0.703125035424104	1.51543783372123	45	28	TGIF1 TRIM33 USP9X NEDD4L WWTR1 NCOR2 SMAD3 UBE2D3 UBC NCOR1
"Downregulation of TGF-beta receptor signaling"	0.174282571742826	0.478387875498164	0.558075817876881	1.19774738843519	1742	26	NEDD4L SMAD3 XPO1 UBC USP15 UBA52 SMURF2 UBB UCHL5 PPP1CC SMAD2 MTMR4 PPP1CB
"Downstream TCR signaling"	0.0133986601339866	0.155620152270487	0.564918186251911	1.28184562427373	133	85	PSMD9 PSMD6 PSMD2 PIK3CB PSMC1 PSMB9 PSMB8 UBC PSMB4 IKBKG MAP3K7 NFKBIA PSMD4 PSMD11 HLA-DPA1 PSMC4 PSMB10 TAB2 PDPK1 UBA52 PSMB7 BCL10 PSME3 HLA-DRB1 HLA-DRB5 PSMA7 PSMC2 PSMD7 UBB PSMD12 PSMD13 FBXW11 PSMC3 RELA UBE2V1 HLA-DQA1 PSMC6 UBE2D2 HLA-DRA PSMA5 CHUK PSMF1
"Downstream signal transduction"	0.132986701329867	0.434235686943435	0.570651810483029	1.22719658807181	1329	27	GRB7 PLCG1 PIK3CB PDGFA NCK1 GRB2 BCAR1 KRAS STAT6 NRAS
"Downstream signaling events of B Cell Receptor (BCR)"	0.0416958304169583	0.269833816618338	0.54447638938786	1.23167957553958	416	78	PSMD9 PSMD6 PSMD2 PSMC1 PSMB9 PSMB8 UBC PSMB4 IKBKG MAP3K7 NFKBIA PSMD4 PSMD11 PSMC4 PSMB10 UBA52 PSMB7 BCL10 PSME3 FKBP1A KRAS PSMA7 PSMC2 PSMD7 UBB PSMD12 PSMD13 NRAS FBXW11 PSMC3 RELA PSMC6 PSMA5 CHUK PSMF1 CALM1
"Downstream signaling of activated FGFR1"	0.587741225877412	0.765011563359793	0.448986475965937	0.949794208516228	5877	20	PLCG1 FGFR1 GRB2 KRAS NRAS SHC1 FRS2 PTPN11
"Downstream signaling of activated FGFR2"	0.542245775422458	0.740844820709803	0.464104999978982	0.977884785193301	5422	19	PLCG1 FGFR2 GRB2 KRAS NRAS SHC1 FRS2 PTPN11
"Downstream signaling of activated FGFR3"	0.648935106489351	0.796689600816795	0.433547489694103	0.909022393446706	6489	18	PLCG1 GRB2 KRAS NRAS SHC1 FRS2 PTPN11
"Downstream signaling of activated FGFR4"	0.642735726427357	0.794685768789124	0.435071444449491	0.916710110898389	6427	19	PLCG1 GRB2 KRAS NRAS SHC1 FRS2 PTPN11
"Drug resistance in ERBB2 KD mutants"	0.0546945305469453	0.302871082754738	0.834157868762712	1.58209371564666	546	4	ERBB2 ERBIN CDC37
"Drug resistance in ERBB2 TMD/JMD mutants"	0.0546945305469453	0.302871082754738	0.834157868762712	1.58209371564666	546	4	ERBB2 ERBIN CDC37
"Drug resistance of ALK mutants"	0.995900409959004	0.998412596756853	0.00473734077271293	0.00955032040476043	9959	1	ALK
"Drug resistance of KIT mutants"	0.452754724527547	0.685429777917731	0.539477839772608	1.08756926475988	4527	1	KIT
"Drug-mediated inhibition of ERBB2 signaling"	0.0546945305469453	0.302871082754738	0.834157868762712	1.58209371564666	546	4	ERBB2 ERBIN CDC37
"Drug-mediated inhibition of MET activation"	0.208379162083792	0.510485179027008	0.786030108432467	1.58461038449208	2083	1	MET
"Dual Incision in GG-NER"	0.28987101289871	0.571212203433847	0.499158373488566	1.09852894194744	2898	41	CUL4A UBC DDB1 ERCC1 GTF2H5 RBX1 UBA52 RPA1 POLD1 UBB ERCC4 ERCC5 POLD2 POLD3 GTF2H1 RFC1 PARP2 CHD1L ERCC3 DDB2 RFC5 POLK POLE3 RFC2
"Dual incision in TC-NER"	0.0290970902909709	0.227747318726071	0.566907808332724	1.27318268958259	290	65	POLR2B ISY1 POLR2H CUL4A UBC DDB1 MNAT1 PPIE XAB2 ERCC1 GTF2H5 POLR2C ERCC6 HMGN1 RBX1 POLR2F UBA52 POLR2G EP300 RPA1 POLD1 UBB ERCC4 PRPF19 TCEA1 ERCC5 POLD2 USP7 ERCC8 POLR2A POLD3 POLR2E GTF2H1
"E2F mediated regulation of DNA replication"	0.6003399660034	0.771455975421566	0.444455088350045	0.945596898941269	6003	22	TFDP2 TFDP1 ORC3 PPP2R1A E2F1 ORC2 PPP2CA CCNB1 POLA2 POLA1 PPP2R3B ORC5 PRIM2 PPP2CB ORC4
"E2F-enabled inhibition of pre-replication complex formation"	0.785921407859214	0.874008143512704	0.379601383157224	0.757732728059458	7859	9	ORC3 ORC2 CCNB1 ORC5 ORC4 ORC6 MCM8
"E3 ubiquitin ligases ubiquitinate target proteins"	0.293770622937706	0.573953894933087	0.487424988474167	1.08637688604168	2937	54	HLTF UBE2D3 VCP UBC H2BC11 UBE2J2 WAC CDC73 RRAGA UBA52 UBE2V2 BCL10 PEX2 UBB RNF40 UBE2E1 UBE2D2 SHPRH H2BC15 H2BC4 PEX10 HLA-B H2BC12 UBE2L3 PEX14 HLA-A
"ECM proteoglycans"	0.005999400059994	0.124141432010645	0.649346495213215	1.43054107926662	59	42	LAMB2 ITGB1 LAMA5 LAMA1 HSPG2 COL9A3 ITGB5 ITGAV TGFB2 IBSP BGN COL9A2 LAMC1
"EGFR Transactivation by Gastrin"	0.314668533146685	0.590094902206139	0.590254408094496	1.16874300374879	3146	8	GRB2 KRAS NRAS
"EGFR downregulation"	0.288471152884712	0.569648173844932	0.513320815037417	1.11338062141264	2884	31	ARHGEF7 CDC42 UBC HGS GRB2 EGF UBA52 EPS15L1 UBB PTPN12 EPN1 EPS15 EREG SH3KBP1
"EGFR interacts with phospholipase C-gamma"	0.239176082391761	0.53172203440813	0.612925130000284	1.22347665592924	2391	9	PLCG1 EGF EREG
"EGR2 and SOX10-mediated initiation of Schwann cell myelination"	0.391660833916608	0.642854833160752	0.498762104710425	1.06298402318815	3916	23	SMARCA4 WWTR1 HDAC2 TEAD1 UTRN LAMC1 SCD5
"EML4 and NUDC in mitotic spindle formation"	0.18968103189681	0.492722938006629	0.486063090771812	1.10803460681581	1896	96	DYNC1H1 NEK9 RANGAP1 XPO1 DYNC1I2 NUP85 NEK6 PPP2R5C NEK7 CENPT ITGB3BP MAD1L1 CLIP1 SKA2 SPDL1 AHCTF1 CENPC BUB1 CLASP2 CENPP KNTC1 SPC24 SEC13 PPP2R1A EML4 DYNLL1 TAOK1 PPP1CC CENPN RANBP2 SGO2 NUP37 AURKB PPP2R5E KIF2A PPP2CA NDC80 CENPK NUP160 CLASP1 DYNC1LI2 NUP98 PAFAH1B1 SEH1L PPP2R5B BUB3
"EPH-Ephrin signaling"	0.0430956904309569	0.27241427293302	0.534946669285158	1.21604003794124	430	89	VAV3 AP2M1 ARHGEF7 EPHB6 ACTR3 CLTC DNM1 PTK2 EPHB1 MYH14 CDC42 MYL9 RHOA MYL6 APH1A FYN ARHGEF28 LIMK1 KALRN YES1 EFNA1 SDCBP CLTA CFL1 EPHA2 MYL12B ARPC2 PSEN2 ARPC5 MYL12A RAC1 AP2A1 ACTB VAV2 ARPC4 EPHA7
"EPH-ephrin mediated repulsion of cells"	0.0857914208579142	0.368264237406047	0.555872751277202	1.23076820059328	857	47	VAV3 AP2M1 EPHB6 CLTC DNM1 EPHB1 APH1A FYN YES1 EFNA1 CLTA EPHA2 PSEN2 RAC1 AP2A1 VAV2 EPHA7
"EPHA-mediated growth cone collapse"	0.202979702029797	0.504531682355378	0.587781365757374	1.21795696592159	2029	15	MYH14 MYL9 RHOA MYL6 FYN YES1 MYL12B
"EPHB-mediated forward signaling"	0.222777722227777	0.51237463931332	0.526432402661093	1.1452545605275	2227	33	ACTR3 PTK2 CDC42 RHOA FYN ARHGEF28 LIMK1 KALRN YES1 CFL1 ARPC2 ARPC5 RAC1 ACTB ARPC4 ITSN1 ARPC1B ROCK2 SRC ROCK1 RASA1 ACTR2 LIMK2 ARPC3
"ER Quality Control Compartment (ERQC)"	0.406159384061594	0.652063573483501	0.498708678051363	1.05807528512685	4061	21	OS9 UBC SYVN1 MAN1B1 UBA52 UGGT2 UBB AMFR UGGT1 DERL2 RNF5 RNF185
"ER to Golgi Anterograde Transport"	0.0925907409259074	0.376517214050407	0.494901963954961	1.14043144187569	925	132	SPTAN1 DYNC1H1 COPG1 ARFGAP1 DYNC1I2 ARF4 DCTN3 SEC24B ANK2 PPP6R1 COPB2 SEC24C SEC16A F8 GORASP1 CSNK1D DCTN2 TRAPPC9 CD55 ARFGAP2 STX5 BET1L SPTBN2 SAR1B COG8 PPP6R3 SEC22A ANKRD28 SEC31A COG1 COG6 CAPZA1 COPB1 TRAPPC5 CAPZB COPA USO1 SEC13 GBF1 MIA3 DYNLL1 SCFD1 DCTN5 TFG PPP6C GOSR1 SPTBN4 COG2 CAPZA2 TMEM115 TRAPPC3 LMAN2 TRAPPC2 COPZ1 ARF1 COPE DYNC1LI2 COG4 NAPG TRAPPC6A GOSR2 TMED10 PREB DCTN4 CNIH3
