pathway	pval	padj	ES	NES	nMoreExtreme	size	leadingEdge
"Loss of MECP2 binding ability to 5hmC-DNA"	0.152984701529847	0.453892110788921	0.846352247605011	1.70621779764603	1529	1	MECP2
"Loss of MECP2 binding ability to 5mC-DNA"	0.443555644435557	0.681990176616856	0.570413266649118	1.08186624892196	4435	4	MECP2 HDAC1 SIN3A BDNF
"Loss of MECP2 binding ability to the NCoR/SMRT complex"	0.008999100089991	0.132167817700989	0.846619629317607	1.65944849972392	89	7	NCOR2 TBL1XR1 NCOR1 GPS2 TBL1X HDAC3 MECP2
"Loss of Nlp from mitotic centrosomes"	0.0210978902109789	0.195701119543218	0.570859821484655	1.28528015294206	210	69	OFD1 PCM1 TUBA4A DYNC1H1 CDK5RAP2 HAUS7 DYNC1I2 TUBB4A DCTN3 SDCCAG8 CEP63 CEP135 SFI1 CSNK1D DCTN2 CSNK1E
"Loss of function of MECP2 in Rett syndrome"	0.082991700829917	0.366609367944072	0.667841502315013	1.3716095638778	829	13	NCOR2 TBL1XR1 NCOR1 GPS2 TBL1X HDAC3 MECP2 CALM1 HDAC1
"Loss of function of TP53 in cancer due to loss of tetramerization ability"	0.006999300069993	0.128373526283735	0.992630803242447	2.0011104688108	69	1	TP53
"Loss of phosphorylation of MECP2 at T308"	0.334666533346665	0.602399760023998	0.631770648665601	1.19823885911	3346	4	MECP2 CALM1
"Loss of proteins required for interphase microtubule organization from the centrosome"	0.0210978902109789	0.195701119543218	0.570859821484655	1.28528015294206	210	69	OFD1 PCM1 TUBA4A DYNC1H1 CDK5RAP2 HAUS7 DYNC1I2 TUBB4A DCTN3 SDCCAG8 CEP63 CEP135 SFI1 CSNK1D DCTN2 CSNK1E
"Lysine catabolism"	0.583941605839416	0.762525689178655	0.465642842562543	0.944602153314818	5839	11	ALDH7A1 DLST DLD PIPOX OGDH AASS
"Lysosomal oligosaccharide catabolism"	0.152484751524848	0.453892110788921	0.745301395103975	1.41356534250006	1524	4	MANBA MAN2B2 MAN2B1 MAN2C1
"Lysosome Vesicle Biogenesis"	0.150984901509849	0.451834915395976	0.549923643331157	1.19635979336242	1509	33	AP1M1 CLTC DNM2 HSPA8 AP1G1 APP AP1S2 AP1M2 AP1G2 HGS CLTA GNS VAMP2 AP1S3 DNASE2 AP1S1 ARF1 ARRB1 CLTB M6PR CHMP2A
"Lysosphingolipid and LPA receptors"	0.34976502349765	0.611394311832355	0.566105337132359	1.13001838377563	3497	9	S1PR3 LPAR3 PLPPR2 PLPPR3
"M Phase"	0.0004999500049995	0.0336216378362164	0.520094335877232	1.22850210631636	4	367	OFD1 PCM1 TUBA4A DYNC1H1 CDC27 SMC4 NEK9 PSMD9 PSMD6 PSMD2 MAU2 RANGAP1 XPO1 CDK5RAP2 HAUS7 DYNC1I2 KPNB1 VRK1 NUP85 PSMC1 NEK6 TUBB4A DCTN3 CDC16 ANAPC2 PSMB9 PPP2R5C CSNK2A1 PSMB8 GORASP2 NEK7 LMNB1 UBC NUP93 SDCCAG8 H2BC11 ANAPC5 CENPT NCAPD3 NUP214 CEP63 TUBGCP3 PSMB4 ENSA TMPO PPP2R2A NUP58 ARPP19 TUBGCP2 NUP54 CSNK2B IST1 ITGB3BP SMC1A CEP135 SFI1 MAD1L1 GORASP1 CSNK1D DCTN2 PSMD4 CSNK1E PSMD11 CLIP1 CHMP6 LEMD2 PSMC4 ANAPC1 NUP88 SKA2 LBR PPP2R2D PRKAR2B PSMB10 NUP42 POM121C MZT2B SPDL1 PHF8 AHCTF1 CENPC BUB1 CLASP2 TPR CENPP NUMA1 HDAC8 PDS5B UBA52 RCC1 PSMB7 CEP43 POM121 KNTC1 PSME3 USO1 ANAPC7 SPC24 STAG1 TNPO1 PSMA7 PSMC2 SEC13 PSMD7 SUMO1 BLZF1 PPP2R1A UBB EML4 PSMD12 PLK4 NCAPH2 DYNLL1 PSMD13 MZT2A TAOK1 UBE2E1 CEP250 CEP290 KMT5A PSMC3 PPP1CC NUP50 CENPN RANBP2 PSMC6 PSMA5 LPIN3 CEP70 TUBA1C SGO2 CTDNEP1 CC2D1B NUP37 ALMS1 PSMF1 UBE2I H2BC15 TUBB3 AURKB ANKLE2 NCAPG2 YWHAE SET PPP2R5E KIF2A PPP2CA PSMD1 H2BC4 CSNK2A2 ANAPC15 LPIN2 NDC80 H3-3A H2BC12 PCNT CENPK ANAPC11 TUBB6 CCNB1 NUP160 CLASP1 NIPBL RAN CHMP4A CDC23 ANAPC16 PDS5A
"MAP kinase activation"	0.728427157284272	0.841551038029244	0.405664733622796	0.909502232993949	7284	63	RPS6KA1 UBC VRK3 IKBKG RPS6KA5 MAP3K7 IRAK1 DUSP7 TAB2 MAP2K7 UBA52 ATF1 PPP2R1A UBB FBXW11 MAPK8 UBE2V1 CHUK PPP2CA CREB1 ATF2 MEF2C ELK1 MEF2A TAB3 MAP2K3 MAP2K4 MAP2K1 SKP1 FOS DUSP6 PPP2CB RPS6KA3 TNIP2 MAPK9 IRAK2 MAPK14 RPS27A MAPK7 DUSP3 TRAF6 BTRC
"MAP2K and MAPK activation"	0.231976802319768	0.524009645547073	0.521565216878984	1.13880013430215	2319	35	IQGAP1 VCL RAP1B ARRB2 TLN1 MARK3 CNKSR1 CSK KRAS NRAS LAMTOR2 APBB1IP BRAF WDR83 ARRB1
"MAP3K8 (TPL2)-dependent MAPK1/3 activation"	0.60973902609739	0.77530366711228	0.448472186676777	0.933251635377959	6097	16	UBC IKBKG UBA52 UBB FBXW11 CHUK MAP2K4 MAP2K1 SKP1 TNIP2 RPS27A BTRC NFKB1
"MAPK family signaling cascades"	0.0006999300069993	0.0376562343765623	0.533529828519812	1.25287643065182	6	280	ERBB2 SPTAN1 RASAL1 MRAS IQGAP1 DLG1 VCL JAK1 RAP1B ARRB2 PSMD9 PSMD6 PSMD2 PTK2 XPO1 DUSP2 PIK3CB PSMC1 PDGFA RGL3 PSMB9 PPP2R5C PSMB8 CDC42 UBC PAQR3 CDC42EP2 BCL2L1 SEPTIN7 RALGDS ERBB3 FGFR2 PSMB4 FNTB PPP5C FGFR1 TLN1 TNRC6A PSMD4 CCND3 SYNGAP1 PSMD11 PSMC4 ABHD17B MAPK6 CAMK2G SPTBN2 DUSP7 DUSP16 PSMB10 MARK3 MAPKAPK5 CNKSR1 FYN AGO1 TNRC6B ERBB4 RBX1 RET KALRN RASAL2 GRB2 CUL3 NF1 TYK2 DUSP9 EGF UBA52 PSMB7 LAT PSME3 RAPGEF2 RASA2 AGO3 CSK KRAS PSMA7 PSMC2 PSMD7 PPP2R1A UBB PSMD12 MAPK4 SHC3 FNTA PSMD13 NRAS NCOA3 PSMC3 PPP1CC MET PSMC6 RAC1 PSMA5 LAMTOR2 CDC42EP3 APBB1IP PSMF1 MAP3K11 CALM1 SPTBN4 JAK2 PPP2R5E PPP2CA PSMD1 MYC LYPLA1 SHC1 TNRC6C BRAF CDC14B WDR83 FRS2 PPP1CB EREG ARRB1 ICMT PSMA6
"MAPK targets/ Nuclear events mediated by MAP kinases"	0.694230576942306	0.825193657104878	0.415276066078069	0.900723896174157	6942	31	RPS6KA1 VRK3 RPS6KA5 DUSP7 ATF1 PPP2R1A MAPK8 PPP2CA CREB1 ATF2 MEF2C ELK1 MEF2A FOS DUSP6 PPP2CB RPS6KA3 MAPK9 MAPK14 MAPK7 DUSP3
"MAPK1 (ERK2) activation"	0.363063693630637	0.619871087644409	0.568731960677878	1.12612712575319	3630	8	JAK1 TYK2 JAK2 PTPN11
"MAPK1/MAPK3 signaling"	0.0015998400159984	0.0586850405868504	0.530506167151604	1.24164574082726	15	241	ERBB2 SPTAN1 RASAL1 MRAS IQGAP1 DLG1 VCL JAK1 RAP1B ARRB2 PSMD9 PSMD6 PSMD2 PTK2 DUSP2 PIK3CB PSMC1 PDGFA RGL3 PSMB9 PPP2R5C PSMB8 UBC PAQR3 BCL2L1 RALGDS ERBB3 FGFR2 PSMB4 FNTB PPP5C FGFR1 TLN1 PSMD4 SYNGAP1 PSMD11 PSMC4 ABHD17B CAMK2G SPTBN2 DUSP7 DUSP16 PSMB10 MARK3 CNKSR1 FYN ERBB4 RBX1 RET RASAL2 GRB2 CUL3 NF1 TYK2 DUSP9 EGF UBA52 PSMB7 LAT PSME3 RAPGEF2 RASA2 CSK KRAS PSMA7 PSMC2 PSMD7 PPP2R1A UBB PSMD12 SHC3 FNTA PSMD13 NRAS PSMC3 PPP1CC MET PSMC6 PSMA5 LAMTOR2 APBB1IP PSMF1 MAP3K11 CALM1 SPTBN4 JAK2 PPP2R5E PPP2CA PSMD1 LYPLA1 SHC1 BRAF WDR83 FRS2 PPP1CB EREG ARRB1 ICMT PSMA6
"MAPK3 (ERK1) activation"	0.501249875012499	0.719766279599798	0.506109760573184	1.01025956856907	5012	9	JAK1 TYK2 JAK2 PTPN11 MAP2K1
"MAPK6/MAPK4 signaling"	0.013998600139986	0.15836734083601	0.563258144267411	1.27944019532381	139	87	PSMD9 PSMD6 PSMD2 XPO1 PSMC1 PSMB9 PSMB8 CDC42 UBC CDC42EP2 SEPTIN7 PSMB4 TNRC6A PSMD4 CCND3 PSMD11 PSMC4 MAPK6 PSMB10 MAPKAPK5 AGO1 TNRC6B KALRN UBA52 PSMB7 PSME3 AGO3 PSMA7 PSMC2 PSMD7 UBB PSMD12 MAPK4 PSMD13 NCOA3 PSMC3 PSMC6 RAC1 PSMA5 CDC42EP3 PSMF1 PSMD1 MYC TNRC6C CDC14B
"MASTL Facilitates Mitotic Progression"	0.245475452454755	0.535343239869562	0.60030110568846	1.20780204540672	2454	10	ENSA ARPP19 PPP2R2D PPP2R1A PPP2CA CCNB1
"MECP2 regulates neuronal receptors and channels"	0.508049195080492	0.724800884672876	0.479316988830413	1.00075429914366	5080	17	HDAC2 GRIA2 FKBP5 MECP2 MET HDAC1 CREB1 SIN3A SLC2A3 PTPN4
"MECP2 regulates transcription factors"	0.583341665833417	0.762525689178655	0.487167569042628	0.936895108698729	5833	5	MECP2 CREB1 MEF2C PPARG RBFOX1
"MECP2 regulates transcription of genes involved in GABA signaling"	0.152984701529847	0.453892110788921	0.846352247605011	1.70621779764603	1529	1	MECP2
"MECP2 regulates transcription of neuronal ligands"	0.401159884011599	0.649416421083343	0.570420681303638	1.10693482558315	4011	6	MECP2 HDAC1 CREB1 SIN3A BDNF
"MET Receptor Activation"	0.171382861713829	0.474191895096205	0.707692602451689	1.36099728272603	1713	5	SPINT2 MET
"MET activates PI3K/AKT signaling"	0.61953804619538	0.782013352366536	0.465938464369908	0.896068408413628	6195	5	GRB2 MET PIK3R1 PIK3CA
"MET activates PTK2 signaling"	0.003999600039996	0.0998250690394878	0.770622917885843	1.60896487306805	39	17	LAMB2 ITGB1 LAMA5 LAMA1 PTK2
"MET activates PTPN11"	0.392960703929607	0.643735017978932	0.598560046284904	1.13525044014648	3929	4	GRB2 MET PTPN11
"MET activates RAP1 and RAC1"	0.209279072092791	0.510485179027008	0.616996463228618	1.24139299967071	2092	10	RAP1B DOCK7 GRB2 MET RAC1
"MET activates RAS signaling"	0.340865913408659	0.604568773891842	0.5616054326828	1.12994659493071	3408	10	RANBP10 GRB2 KRAS NRAS MET SHC1
"MET activates STAT3"	0.361663833616638	0.619303440680667	0.645207137969153	1.21829545622048	3616	2	MET STAT3
"MET interacts with TNS proteins"	0.198280171982802	0.498480058536203	0.713207987227406	1.35269583468073	1982	4	ITGB1 MET TNS3
"MET promotes cell motility"	0.0167983201679832	0.177592721077237	0.661843318897921	1.42646379366732	167	28	LAMB2 ITGB1 LAMA5 LAMA1 RAP1B PTK2 DOCK7 GRB2 LAMC3 LAMC1 MET RAC1 TNS3
"MET receptor recycling"	0.255074492550745	0.543126953795386	0.605457495196317	1.2085703053646	2550	9	RAB4A GGA3 GRB2 MET
"MGMT-mediated DNA damage reversal"	0.291370862913709	0.572107752728377	0.703916201705443	1.41907149747623	2913	1	MGMT
"MHC class II antigen presentation"	0.0016998300169983	0.0596418619007665	0.593052470686124	1.35458988632434	16	101	CTSB AP2M1 AP1M1 DYNC1H1 CD74 CTSA CLTC DNM1 DNM2 KIF5A LGMN RAB7A DYNC1I2 KLC1 DCTN3 SEC24B HLA-DMA AP1G1 KIF5C SEC24C CTSD CTSH DCTN2 AP1S2 HLA-DPA1 SPTBN2 SAR1B OSBPL1A AP1M2 SEC31A KIF26A CAPZA1 CLTA CAPZB HLA-DRB1 KLC3 HLA-DRB5 SEC13 DYNLL1 CANX DCTN5 HLA-DQA1 HLA-DRA AP2A1 CTSS AP1S3 CAPZA2 KIF2A AP1S1 ARF1 HLA-DMB KLC4
"MPS I - Hurler syndrome"	0.328867113288671	0.599990415427184	0.666701758079798	1.34404842496328	3288	1	IDUA
"MPS II - Hunter syndrome"	0.645735426457354	0.795022683801778	0.346931255921676	0.699401797641954	6457	1	IDS
"MPS IIIA - Sanfilippo syndrome A"	0.147885211478852	0.44874800019998	0.851194862617118	1.71598034739312	1478	1	SGSH
"MPS IIIB - Sanfilippo syndrome B"	0.651934806519348	0.798348086283936	0.341772818191389	0.689002559867881	6519	1	NAGLU
"MPS IIIC - Sanfilippo syndrome C"	0.116888311168883	0.409531984572889	0.882356037477629	1.77880023272221	1168	1	HGSNAT
"MPS IIID - Sanfilippo syndrome D"	0.150884911508849	0.451834915395976	0.848984103589852	1.71152353120423	1508	1	GNS
"MPS IV - Morquio syndrome A"	0.695230476952305	0.825193657104878	0.302031792820297	0.608885983139058	6952	1	GALNS
"MPS IV - Morquio syndrome B"	0.456454354564544	0.685956544010403	0.53547741867565	1.07950454975142	4564	1	GLB1
"MPS IX - Natowicz syndrome"	0.964303569643036	0.987554544037982	0.0374776292241289	0.0755536458687713	9643	1	HYAL1
"MPS VI - Maroteaux-Lamy syndrome"	0.540945905409459	0.739486186897968	0.451837035477419	0.910888337271815	5409	1	ARSB
"MPS VII - Sly syndrome"	0.215178482151785	0.511783650903202	0.778397726076429	1.5692237571733	2151	1	GUSB
"MTF1 activates gene expression"	0.687431256874313	0.822198253547427	0.389819723413628	0.73606686881175	6874	2	CSRP1 MTF1
"MTOR signalling"	0.0566943305669433	0.305015498450155	0.58410069720051	1.28426186885254	566	40	EIF4G1 AKT2 STRADA TSC2 RPS6 EIF4E PRKAG2 RPS6KB1 EIF4B STRADB RRAGA FKBP1A AKT1 STK11 CAB39 LAMTOR2 LAMTOR4 PPM1A PRKAA2 RRAGC MTOR PRKAB1
Macroautophagy	0.0671932806719328	0.329125269291253	0.510730225018968	1.17115950541336	671	113	ATG4B ATG4D TSC2 DYNC1H1 WDR45 VCP ULK1 EPAS1 HSPA8 DYNC1I2 TOMM5 MTMR14 GABARAP CSNK2A1 UBC ATM PARK7 MAP1LC3B CSNK2B WDR45B USP30 PRKAG2 CHMP6 ATG3 PIK3R4 ATG13 RRAGA UBA52 MAP1LC3C ATG12 BECN1 UBB TOMM7 MFN1 PGAM5 DYNLL1 UBE2V1 IFT88 TOMM70 WIPI2 LAMTOR2 LAMTOR4 ATG9A NBR1 PRKAA2 RRAGC CSNK2A2 GABARAPL1 MTOR PCNT ATG16L1 MFN2 CHMP4A PRKAB1 MTMR3 DYNC1LI2
"Major pathway of rRNA processing in the nucleolus and cytosol"	0.0134986501349865	0.155620152270487	0.517740753981745	1.20344101048109	134	180	RPS24 RPL18A RPL35 RPL22L1 RPS21 NCL NOP56 RPS9 RPS6 RPL24 NOL6 RPL22 RPL7A RPL15 WDR75 PWP2 RPL6 RCL1 RPL3 RPLP0 RBM28 UTP4 DDX49 EXOSC3 CSNK1D RPL27A RPS3 CSNK1E RPS14 RPL26 RPL17 LAS1L RPL29 EXOSC10 RPS26 NOP58 RPSA RPS8 RPL35A RPL8 RPL10A EXOSC2 RPL10 NOL9 TEX10 RPP14 UBA52 RPS29 RPL32 RPL31 RPL9 WDR12 RPS3A EXOSC7 IMP4 DDX52 ISG20L2 DHX37 RPL13A NOC4L PELP1 SENP3 RPS20 RRP9 TBL3 RIOK3 DIS3 WDR46 RPL10L RPS13 RPL28 RPL5 GNL3 NOL11 RPL21 RPS2 RPP38 RPL12 RPLP2 RPS15A RPL4 RPS18 RPS17 TSR1 RPL38 RPL30 MTREX DDX47 RPL39L UTP15 EBNA1BP2 FCF1 WDR43 NIP7 UTP18 MPHOSPH10 RPL14 RPL27 RRP7A FAU RRP1
"Manipulation of host energy metabolism"	0.21007899210079	0.510485179027008	0.761294775995759	1.43749489405736	2100	2	ENO1 PGK1
"Masitinib-resistant KIT mutants"	0.452754724527547	0.685429777917731	0.539477839772608	1.08756926475988	4527	1	KIT
"Maturation of nucleoprotein"	0.282471752824718	0.563779153824107	0.576948882449288	1.17039736660609	2824	11	GSK3B PARP6 SUMO1 PARP10 UBE2I PARP9
"Maturation of protein 3a"	0.113388661133887	0.406303422521184	0.684189515725775	1.365729450058	1133	9	ST6GALNAC4 ST6GAL1 ST6GALNAC2 GALNT1 ST3GAL4 ST3GAL2
"Maturation of protein E"	0.169383061693831	0.47390352497931	0.732675507799757	1.38961863204333	1693	4	UBC UBA52 UBB
"Maturation of spike protein"	0.339166083391661	0.604033351257086	0.611508897546594	1.17602182789599	3391	5	PRKCSH GANAB CANX MOGS MGAT1
Meiosis	0.407759224077592	0.653332284243449	0.45720621043558	1.03320539685167	4077	76	REC8 SUN1 SYNE2 LMNB1 H2BC11 SUN2 SYNE1 ATM ATR ACD SMC1A RAD51C RPA1 MLH3 DIDO1 STAG1 SYCP2 RAD50 UBE2I TINF2 H2BC15 TOP3A H2BC4 H3-3A H2BC12 BRCA1 RBBP8 CDK4 STAG2 MRE11 H3C15 MLH1 TERF2IP
"Meiotic recombination"	0.823317668233177	0.8973799739738	0.381507711595142	0.844703322178606	8233	47	H2BC11 ATM RAD51C RPA1 MLH3 RAD50 H2BC15 TOP3A H2BC4 H3-3A H2BC12 BRCA1 RBBP8 CDK4 MRE11 H3C15 MLH1 H2BC17 TEX15 H2AZ2
"Meiotic synapsis"	0.309469053094691	0.58619758633036	0.48616208980451	1.07974250448029	3094	50	REC8 SUN1 SYNE2 LMNB1 H2BC11 SUN2 SYNE1 ATR ACD SMC1A DIDO1 STAG1 SYCP2 UBE2I TINF2 H2BC15 H2BC4 H2BC12 BRCA1
"Melanin biosynthesis"	0.672132786721328	0.812398141114496	0.403069533367809	0.761085474950815	6721	2	TYRP1 OCA2
"Membrane Trafficking"	0.0001999800019998	0.0161383861613839	0.509040758498232	1.21006095694154	1	580	ALS2CL SPTAN1 AKT2 AP2M1 HIP1R AP1M1 TPD52L1 TSC2 ANKRD27 PACSIN2 DYNC1H1 PUM1 TPD52 FTH1 ALS2 ACTR3 TJP1 COPS3 COPG1 CLTC ARRB2 DNM1 DNM2 TFRC SNX2 GDI1 VPS51 KIF5A REPS1 ARFGAP1 ARFIP2 ULK1 RAB7A MAN1A2 BICD1 SNX9 DENND4B HSPA8 GAPVD1 DYNC1I2 ARFRP1 GCC2 KIF21A CYTH1 ARF4 KLC1 DENND1A DCTN3 RAB4A SEC24B GABARAP DENND1B VPS53 MON1A HIP1 KIF27 KIF1B UBC SORT1 GAK CPD STXBP3 TRAPPC8 ANK2 AP1G1 PPP6R1 MAN2A1 COPB2 KIF5C SNX5 DVL2 RAB35 SCARB2 SEC24C MAP1LC3B AKT3 SEC16A COPS8 RGP1 VPS37A PRKAG2 F8 SYTL1 GORASP1 CSNK1D APP RAB9A USE1 DCTN2 SNAPIN TRAPPC9 GGA3 IGF2R FNBP1L AP1S2 CD55 RAB36 CHMP6 TBC1D8B GGA1 ARFGAP2 RALGAPB STX5 BET1L SPTBN2 SAR1B DENND2C COG8 RAB6B AP1M2 NAA38 KIF13B STX16 CUX1 RAB5B RAB13 EXOC1 PPP6R3 SEC22A RAB18 ANKRD28 AP1G2 SEC31A COG1 KIF26A TBC1D24 HGS TRIP10 KIF9 PLA2G6 BLOC1S6 DENND2D GRB2 COG6 HPS1 ARL1 RIC1 CAPZA1 EPN2 EGF DENND6B COPB1 CLTA UBA52 GALNT1 VPS37D RAB38 TRAPPC5 GNS AGFG1 CAPZB TOR1B DENND5A COPA VTI1A RAB31 USO1 KLC3 AKT1 RABEP1 BIN1 GALNT2 MON1B TBC1D7 AAK1 RIN2 SEC13 EXOC4 EPS15L1 HPS4 DENND3 MVB12A UBB ARPC2 GOLGA4 VAMP3 GBF1 TBC1D4 RAB5C MIA3 RAB11B DAB2 DYNLL1 SCFD1 SNAP23 KIF1C BICD2 ARPC5 SNF8 CCZ1B DENND5B GPS1 RHOQ ASPSCR1 DCTN5 TFG SURF4 NEDD8 RAC1 VAMP2 PPP6C CLINT1 GOSR1 AP2A1 FNBP1 CTTN CHM CALM1 STX6 SBF2 SPTBN4 RAB3GAP2 TBC1D13 AP1S3 COG2 DNASE2 CAPZA2 RABGAP1 YWHAE TMEM115 TRAPPC3 LMAN2 KIF2A EPN1 PRKAA2 TMF1 EXOC3 ARPC4 COPS2 EPS15 TBC1D15 TRAPPC2 MVB12B COPZ1 MADD AP1S1
"Membrane binding and targetting of GAG proteins"	0.209379062093791	0.510485179027008	0.591117807307138	1.21911118529744	2093	14	UBC VPS37A UBA52 VPS37D MVB12A UBB NMT2 MVB12B
"Metabolic disorders of biological oxidation enzymes"	0.561243875612439	0.751103674162971	0.452562628203179	0.971294022550368	5612	26	ACY1 GSS AHCY GCLC SLC35D1 CYP2R1 TBXAS1
Metabolism	9.99900009999e-05	0.0121037896210379	0.475270898899362	1.14190062732886	0	1823	RAPGEF3 CBS ASS1 BDH1 PIP4K2A ACAD9 CKB CBSL MLXIPL CYP4V2 ADRA2C GRHPR PLEKHA5 FHL2 SGMS2 AK2 B4GALT6 PRKAR1A ACAD10 MIGA2 IQGAP1 RPS24 SAT1 ACADVL ABHD3 GPT2 ASL GSTZ1 GALE GLDC LRPPRC RPL18A FOLH1 D2HGDH GNAI2 LRP1 NDST1 CTSA CHRM3 PPA2 SLC44A5 PFKM MTAP AACS PLCG1 RPL35 STARD3 DDAH1 RPL22L1 NCOR2 PSMD9 SDHA PSMD6 DNM2 ABCD4 PSMD2 CD44 HS6ST1 SIN3B SLC6A8 PDP1 GNB1 RPS21 PNPLA6 PI4KB SGMS1 ALDOA SLC2A1 CCNC GBA2 AK1 LGMN RPS9 TIMMDC1 RPS6 PDXK PDPR OSBPL3 PFKL QARS1 DDHD2 PIK3CB GBA ENO1 SQLE LHPP KPNB1 GGT6 NUP85 PSMC1 RPL24 GMPS RPL22 RPL7A TM7SF2 NDUFV1 PANK2 RPL15 NMNAT3 IMPDH1 MIGA1 RAB4A PTGDS GLUD1 ACACB SMPD4 CACNA1D MTMR14 PUDP SEC24B NDUFB6 PIP5K1A NQO1 PSMB9 GGT7 CSNK2A1 LIPE PSMB8 CEPT1 EEFSEC NUDT16 MED14 MOCS1 NDUFA10 SLC27A3 AGL UBC NUP93 PLCB1 AK9 CYB5A PFKFB3 KDSR SLC25A17 NMRK1 MED9 ARSG PTGR1 GAA NUP214 PEMT ALDH6A1 MMAB NAMPT COMT FDFT1 RPL6 VAC14 ALDH1B1 ARNT HSPG2 ALDH7A1 NADSYN1 LSS VKORC1 PPARGC1B ETNK1 PDK1 ACY1 PSMB4 INPP5J PRPS2 UGT2B7 NT5M LPCAT1 TBL1XR1 RPL3 RPLP0 MED13L GLYCTK SEC24C NUP58 FLAD1 UMPS SCAP UPP1 MANBA NCOR1 CBR1 FITM2 NUP54 ANGPTL4 PPOX CSNK2B OSBPL10 PDHB GMPR2 COX4I1 LMBRD1 KYAT3 ABCC5 SLC25A44 ASPG PCCB PRKAG2 HSD17B1 ACOT2 CYB5R3 SC5D NT5E PNP NDUFB11 SMARCD3 ATP5F1B GLTP MED22 PARP6 MED17 NMRAL1 GPX4 PLEKHA2 RPL27A COQ6 GGPS1 ABHD10 GATM ACADM PSMD4 RPS3 PPAT FDPS ESYT1 MGST2 EBP PHKB IP6K1 SPHK2 TXNRD1 PLAAT3 ALDH3A2 MED15 ETFA SURF1 COA1 RPS14 PSMD11 ACOT8 GMPR PAICS NDUFA11 GPS2 RPL26 PSAT1 MED26 TBL1X RPL17 IMPDH2 SLC51A LRP8 NDST2 PTGES2 G6PD CPNE3 CREBBP ADCY7 PSMC4 CKMT1A UGT2B17 DPYD NUP88 CYP3A5 SCO1 HSD17B10 UCKL1 NFS1 IDO1 CYP4F11 LBR ALAS1 SAR1B OSBPL1A PIK3R4 PFAS RPL29 GSS NDUFB1 DHODH HADH AHCY ADK MED25 GLRX5 UQCRC1 ACAD8 PRKAR2B PSMB10 GNPAT ACBD6 UROD PNPLA3 NUP42 INPP5F POM121C SLC19A1 AHCYL1 ETFDH TSTD1 COX6A1 PLPP6 HMGCL CLOCK TKT CYB5B OAZ1 PHKG2 BHMT2 B4GALT4 THTPA SLC35B3 HDAC3 TPR GSR MDH2 CPNE1 GPHN NAXE ME2 NME4 PPCS NT5C2 RPS26 PLA2G6 PRKD3 RPSA DLST GPI RTEL1 THEM4 CERS2 IDI1 RPS8 PLA2R1 ACAA1 RPL35A ATP5MG AMD1 RPL8 RPL10A BSG ACADS CTPS2 ACER2 BCKDK NDUFA2 FPGS HYAL2 MMS19 GNB2 RPL10 PLEKHA1 UQCR11 PPIP5K2 NFYC GNB4 RXRB GCLC HSD17B12 UBA52 CIAPIN1 STX1A HMBS SCP2 SGSH GNAS RPS29 ST3GAL4 PLA2G12A PSMB7 GLUL GNS FH EP300 POM121 FUT9 SLC27A5 PSME3 MECR HS2ST1 RPL32 SUMO2 MAN2B2 GDA ASAH1 BGN SDS PLBD1 RPL31 EHHADH ENTPD4 PNPLA2 SULT2B1 GALT GADL1 CACNB2 SUMF2 THRAP3 COX6C HACL1 PODXL2 LPCAT4 PAPSS2 AKT1 PIK3C2B RPL9 AIMP1 LPCAT2 SLC9A1 AKR1A1 HLCS NDUFS8 AK7 PDHA1 UGCG NDUFAF7 RPS3A PGM1 GALC POLD1 STK11 GSTM3 BTD CTH IP6K3 GNG5 NDUFA13 ACACA CES3 ACSL3 MTHFD1L PSMA7 MAT2A NMNAT1 FBP1 INPPL1 GPC6 NUBP2 ENTPD6 HAL CEMIP HNMT SLC25A11 PSMC2 SLC46A1 SEC13 MTHFD1 FECH SLC25A12 DMGDH PSMD7 B4GALT3 MARS1 PPP2R1A PCYT1A UBB SLC16A3 CAD SCLY MED27 ALDH1L2 CSPG4 CA5B PPCDC PSMD12 ENTPD2 ADRA2A ITPA GART ST6GALNAC6 AGK B3GALT1 ACER3 TYMS NDUFC1 VAPB PARP10 MT-ND1 CIAO1 ALDH3B2 DDAH2 STARD10 PSMD13 ME3 UCK1 UGT8 SPTLC1 RPL13A GSTA4 NCOA3 SMPD1 NDOR1 PLEKHA8 GLS GPD1L STARD4 KHK BCO2 OSBPL9 ATP5PB IDH3B AK4 RPS20 PHKA2 PSAP PSMC3 BPGM COQ9 GOT2 NADK NFYB ECI1 CYP4B1 PLA2G15 PPP1CC GUK1 MCCC2 ORMDL1 NUBP1 UROS IMPA1 NUP50 FAR1 ACOX3 PTGES3 SLC35D1 PRODH RANBP2 RPL10L MTHFD2L ASRGL1 PSMC6 ELOVL5 MAN2B1 TRAP1 COX5B AIP GUSB CDK19 CD320 ACLY PSMA5 LPIN3 RPS13 RPL28 HAGH RPL5 DERA VAMP2 UQCRH RARS1 GSTK1 EXT2 NDUFAF5 RPL21 SCD5 LDHA RPS2 ENTPD8 NUP37 COQ10A GYG1 NNT CYP2R1 CTPS1 INPP4A LRP10 TBXAS1 SUMF1 HSD11B2 RPL12 PSMF1 ALDH3B1 RPLP2 ATIC RUFY1 UBE2I AIMP2 CALM1 IDH3G MED6 PFKP CDS1 CHD9 LPCAT3 RPS15A NDUFA12 SBF2 RPL4 SLC27A1 BCKDHB MGST3 RPS18 PISD SLC35D2 RPS17 CACNA2D2 ST3GAL2 SAMD8 MTRR CRYL1 PRKAR1B ALDH1L1 ACBD4 DNPH1 ACBD5 NUDT9 ABCC1 DBI PTPMT1 SGPL1 PAOX MAN2C1 PPARGC1A HSCB RPL38 PPP2CA PSMD1 PRKAA2 DDHD1 CYC1 GNAI1 DTYMK GPAM ASNS CSNK2A2 CACNA1A RPL30 SPTLC2 SACM1L LYPLA1 MT-ND5 MMADHC MOCS3 B4GALNT1 ST3GAL6 LIPH GLP1R LIAS INPP5B MTMR4 CDK8 OSBPL2 ACSS3 LPIN2 ARSD PARP9 GPCPD1
"Metabolism of Angiotensinogen to Angiotensins"	0.0072992700729927	0.128874882295943	0.799620126271776	1.62210781326191	72	11	AOPEP ANPEP MME CTSD
"Metabolism of RNA"	9.99900009999e-05	0.0121037896210379	0.522862055196553	1.2452231800562	0	681	EIF4G1 SRSF11 H19 PPIL6 SNRPN RPS24 DDX42 POP5 SRSF5 SF3B3 DDX5 SRRM1 CHERP RPL18A GEMIN8 HNRNPU HNRNPH1 POLR2B RPL35 RPL22L1 PSMD9 PSMD6 FUS PSMD2 CD44 SMG1 XPO1 SRSF10 RPS21 NCL SNRNP40 ZCRB1 CPSF4 NOP56 FIP1L1 RPS9 SRRT RPS6 XRN1 EFTUD2 TRMT44 HBS1L HSPA8 HNRNPA2B1 CHTOP EIF4A1 NUP85 PSMC1 RPL24 ADAR NOL6 RPL22 RPL7A RPL15 PCBP2 QTRT1 ISY1 UPF3A POLR2H PSMB9 PSMB8 CNOT11 WDR75 SNRNP70 UBC PWP2 DHX38 NUP93 IGF2BP3 NUP214 U2AF1 RPL6 RCL1 MTERF4 HNRNPC U2AF1L4 PSMB4 ZBTB8OS EIF4E RPL3 FTSJ1 RPLP0 SMG7 PPP2R2A NUP58 METTL3 WTAP U2AF2 EDC4 RBM28 UTP4 DDX46 NUP54 ELAC2 PNRC2 SRSF4 PABPN1 MNAT1 DDX49 PPIE EXOSC3 RBM17 CSNK1D HNRNPR XAB2 GCFC2 TXNL4A RPL27A SF3B1 PSMD4 RPS3 CSNK1E CNOT2 RBM5 YBX1 DDX39B TNKS1BP1 ADARB1 RPS14 HNRNPM PSMD11 GTF2H5 POLR2C RPL26 SUGP1 HNRNPD RPL17 THOC1 PSMC4 SF1 NUP88 HSD17B10 PLRG1 LAS1L RBMX PUS1 RPL29 MTO1 ZC3H11A PSMB10 THADA TTC37 NUP42 EXOSC10 POM121C NSUN4 THOC2 POLDIP3 EIF4B TPR PRKCD RNGTT CNOT7 NCBP2 DHX9 RPS26 NOP58 RPSA RPS8 GSPT2 HNRNPA1 RPL35A C2orf49 RPL8 POLR2F RPL10A PPIL3 CNOT1 EXOSC2 RPL10 NOL9 THOC7 TEX10 RPP14 DDX23 UBA52 TRIT1 RPS29 PRPF40A PSMB7 POLR2G POM121 NUDT21 POP4 PSME3 RPL32 PAPOLA RPL31 SRSF1 DNAJC8 TRMT61A AKT1 WDR4 RPL9 WDR12 RPS3A DDX6 SRSF6 THUMPD1 SYMPK EXOSC7 IMP4 TNPO1 SNRNP35 PSMA7 PRMT5 QTRT2 RNPC3 PSMC2 RBM22 SEC13 DDX52 PSMD7 ISG20L2 PPP2R1A UBB SNRPG HNRNPUL1 TYW5 CCAR1 BCAS2 PSMD12 LAGE3 PRPF3 LSM5 WDR77 HNRNPF CPSF7 FYTTD1 MT-ND1 DHX37 PSMD13 RPL13A PRPF19 DCP1A RNPS1 NOC4L SNRNP200 NAT10 NOP2 THOC5 PELP1 SENP3 DIMT1 RPS20 RRP9 LSM7 TBL3 TYW3 PSMC3 SF3B4 RIOK3 DIS3 WDR46 SLBP U2SURP DHX15 NUP50 RANBP2 RPL10L PSMC6 WBP4 POLR2A PSMA5 TSEN2 RPS13 RPL28 RPL5 GNL3 NOL11 ZNF473 RPL21 RPS2 SNRPA1 NUP37 TRNT1 RPP38 SRSF2 POLR2E TSEN15 RPL12 PSMF1 ACTB PPIH RPLP2 TRMT13 PRPF4 MAGOHB RPS15A GTF2H1 RPL4 NSUN2 RPS18 RPS17 IGF2 SF3B2 SET SNRPB TSR1 TRDMT1 CWC15 TRMT11 GEMIN7 RPL38 PPP2CA PSMD1 APOBEC3B
"Metabolism of amine-derived hormones"	0.996800319968003	0.998412596756853	0.0970695921480987	0.192204251495699	9968	8	SLC5A5 DUOX1 PNMT DUOX2 TPH1 IYD TPO TPH2
"Metabolism of amino acids and derivatives"	0.0001999800019998	0.0161383861613839	0.530322816748532	1.24990953459124	1	330	CBS ASS1 CKB CBSL GRHPR RPS24 SAT1 GPT2 ASL GSTZ1 GLDC RPL18A FOLH1 MTAP RPL35 RPL22L1 PSMD9 PSMD6 PSMD2 SLC6A8 RPS21 RPS9 RPS6 QARS1 PSMC1 RPL24 RPL22 RPL7A RPL15 GLUD1 NQO1 PSMB9 PSMB8 EEFSEC ALDH6A1 RPL6 ALDH7A1 PSMB4 RPL3 RPLP0 PDHB KYAT3 SLC25A44 ASPG NMRAL1 RPL27A GATM PSMD4 RPS3 TXNRD1 RPS14 PSMD11 RPL26 PSAT1 RPL17 PSMC4 CKMT1A HSD17B10 IDO1 RPL29 AHCY ACAD8 PSMB10 TSTD1 OAZ1 BHMT2 GSR RPS26 RPSA DLST RPS8 RPL35A AMD1 RPL8 RPL10A BCKDK RPL10 UBA52 RPS29 PSMB7 GLUL PSME3 RPL32 SDS RPL31 GADL1 PAPSS2 RPL9 AIMP1 PDHA1 RPS3A CTH PSMA7 HAL HNMT PSMC2 SLC25A12 DMGDH PSMD7 MARS1 SCLY PSMD12 PSMD13 RPL13A GLS RPS20 PSMC3 GOT2 MCCC2 PRODH RPL10L ASRGL1 PSMC6 PSMA5 RPS13 RPL28 RPL5 RARS1 RPL21 RPS2 RPL12 PSMF1 RPLP2 AIMP2 RPS15A RPL4 BCKDHB RPS18 RPS17 MTRR PAOX RPL38 PSMD1 ASNS RPL30
"Metabolism of carbohydrates"	0.288371162883712	0.569648173844932	0.445033800666548	1.04344829704751	2883	262	B4GALT6 GALE NDST1 PFKM CD44 HS6ST1 ALDOA SLC2A1 PFKL ENO1 NUP85 AGL UBC NUP93 PFKFB3 GAA NUP214 HSPG2 PRPS2 GLYCTK NUP58 MANBA NUP54 ABCC5 PHKB NDST2 G6PD NUP88 NUP42 POM121C TKT PHKG2 B4GALT4 SLC35B3 TPR MDH2 GPI HYAL2 UBA52 SGSH ST3GAL4 GNS POM121 FUT9 HS2ST1 MAN2B2 BGN GALT PAPSS2 SLC9A1 AKR1A1 PGM1 FBP1 GPC6 CEMIP SLC25A11 SEC13 SLC25A12 B4GALT3 PPP2R1A UBB CSPG4 ST6GALNAC6 B3GALT1 KHK PHKA2 BPGM GOT2 NUP50 RANBP2 MAN2B1 GUSB DERA EXT2 NUP37 GYG1 CALM1 PFKP SLC35D2 ST3GAL2 CRYL1 MAN2C1 PPP2CA
"Metabolism of cofactors"	0.865613438656134	0.924930366627944	0.34893080435844	0.735208896010238	8656	19	COQ6 AKT1 COQ9 CALM1 PDSS2 COQ3 PDSS1 COQ5 HSP90AA1 COQ7 IDH1 PTS
"Metabolism of fat-soluble vitamins"	0.668433156684332	0.808854946589299	0.42123751871951	0.918046887421687	6684	34	LRP1 HSPG2 VKORC1 LRP8 GPC6 BCO2 LRP10 GPC4 APOA1 PLB1 VKORC1L1 GPC5 UBIAD1 SDC3 AGRN RDH11
"Metabolism of folate and pterines"	0.253074692530747	0.542687183894542	0.563133068250207	1.17185607601277	2530	16	SLC19A1 FPGS MTHFD1L SLC46A1 MTHFD1 ALDH1L2 MTHFD2L ALDH1L1 SHMT1 SHMT2
"Metabolism of ingested H2SeO4 and H2SeO3 into H2Se"	0.095990400959904	0.384756226364119	0.789535412824786	1.49746116614997	959	4	TXNRD1 GSR PAPSS2
"Metabolism of ingested MeSeO2H into MeSeH"	0.0951904809519048	0.383454499807923	0.903568796715444	1.8215644452013	951	1	TXNRD1
"Metabolism of ingested SeMet, Sec, MeSec into H2Se"	0.0188981101889811	0.188281171882812	0.802496633756441	1.58899673322668	188	8	CBS AHCY CTH HNMT SCLY
